!!!	チックチックチック	
AAA_(音楽グループ)	Attack_All_Around	
Access_(音楽ユニット)	AXS	
A・A・ミルン	アラン・アレクサンダー・ミルン	A.A.ミルン	
A・C・バクティヴェーダンタ・スワミ・プラブパーダ	A・C・バクティヴェーダーンタ・スワミ・プラブパーダ	A.C.バクティヴェーダンタ・スワミ・プラブパーダ	
A・バートラム・チャンドラー	A・B・チャンドラー	
A・バートレット・ジアマッティ	
A・ローラン	
A・E・ヴァン・ヴォークト	ヴォークト	ヴァン・ヴォクト	ヴァン・ヴォークト	A・E・ヴァン・ヴォクト	ヴォクト	
A・E・J・コリンズ	
A・F・K・オーガンスキー	
A・J・クック	
A・J・クローニン	アーチボルド・ジョゼフ・クローニン	
A・J・ジョンソン	
A・J・P・テイラー	
A・P・ヒル	
A・S・バイアット	アントニア・スーザン・バイアット	
AEKアテネFC	
A.H.M.ジョーンズ	
AI_(歌手)	
Aiko	ベイビー・ピーナッツ	
Aimmy	
AION	
AIR	Air	
Aira_Mitsuki	アイラミツキ	チャイナ・ディスコティカ	カラフル・トーキョーサウンズ・NO.9	カラフル・トーキョーサウンズNO.9	
A.J	
A.J.バックリー	
A.J.ヒンチ	
AKINO_(プロレスラー)	秋野美佳	
Alan	アラン・ダワジュオマ	阿蘭達瓦卓瑪	阿兰达瓦卓玛	་ལན་ཟླ་བ་སྒྲོལ་མ་མ	
AL_B.シュア!	
ANZA	大山アンザ	アンザ	
AOL	エーオーエル・ジャパン	America_Online,inc.	AOLジャパン	America_Online,Inc.	アメリカ・オンライン	アメリカオンライン	America_On_line,inc.	
ARATA	
A.R.ラフマーン	A・R・ラフマーン	
AZU	Azu	
B.B.キング	B・B・キング	BBキング	
B・D・ウォン	ブラッドレイ・ダリル・ウォン	ブラッドレー・ダリル・ウォン	黄栄亮	
B・J・トーマス	B.J.トーマス	ビリー・ジョー・トーマス	
B・J・ノヴァク	B・J・ノヴァック	
BECCA	ベッカ	
BENI	安良城紅	
B.J.アップトン	B.J.アプトン	
BJペン	B・J・ペン	B.J.ペン	
B.K.S.アイアンガー	アイアンガー	
BoA	
B.o.B	
BONNIE_PINK	ボニピン	ボニー・ピンク	浅田香織	Bonnie_Pink	ボニーピンク	
BT_(ミュージシャン)	ブライアン・トランソー	
CC・サバシア	C・C・サバシア	C.C.サバシア	サバシア	
C・B・マクファーソン	クロフォード・ブラウ・マクファーソン	クロフォード・ブロー・マクファーソン	
C・ダグラス・ディロン	ダグラス・ディロン	
C・トーマス・ハウエル	
C・ミシェル・オルムステッド	C._M._オルムステッド	
C・J・チェリイ	C・J・チェリー	C・J・チェリィ	キャロリン・チェリイ	
C・M・コーンブルース	シリル・M・コーンブルース	
C・R・ボクサー	
C・S・ルイス	C.S.ルイス	クライブ・ステープルス・ルイス	
C.G_mix	C.G.mix	CGmix	C.Gmix	
CHARA	Chara_(歌手)	
Clark	
CMパンク	
CoCo_(女性アイドルグループ)	
Colleen	
Crystal_Kay	クリスタルケイ	クリスタル・ケイ	クリスタル・ケイ・ウィリアムス	クリケイ	クリスタル_ケイ	Candy_(Crystal_Kay)	クリスタルケー	
Ш	
DAIGO	泡賀剥ヶ介	DAIGO☆STARDUST	だいご☆ほしくず	ダイゴスターダスト	DAIGO_STARDUST	内藤大湖	ダイゴ☆スターダスト	
DAISHI_DANCE	
D・A・ペネベイカー	
D・B・ウッドサイド	
D・H・ヒル	ダニエル・ヒル	
D・W・グリフィス	映画の父	
DEAN_FUJIOKA	藤岡竜雄	
Dennis_E._Wisnosky	
Die_(ミュージシャン)	堕威	
Difang	郭英男	
DJアシュバ	
D.J.オーガスティン	
DJキャレド	DJ_Khaled	
DJキューバート	Q-Bert	
DJクオールズ	
DJシャドウ	DJ_SHADOW	Unkle	DJ_Shadow	
DJプレミア	DJ・プレミア	DJ_Premier	
D.J.ベンガ	D.J.ムベンガ	
D.J.ホールトン	D・J・ホールトン	デニス・ホールトン	
DJ_Hell	
Dj_KENTARO	DJ_KENTARO	Djケンタロウ	Djkentaro	
DJ_KRUSH	DJ_Krush	
DMX_(ラッパー)	
DOUBLE_(歌手)	DJ_Lilly_a.k.a._DOUBLE	DJ_Lilly	
☆Taku_Takahashi	高橋拓	☆タカハシタク	☆Taku	Taku_Takahashi	
あいざわ遥	
あがた森魚	
あさぎ桜	あさき桜	
あさみ	木村麻美	
あだち充	
あだち勉	
あべなぎさ	
あらいきよこ	
いがらしゆみこ	五十嵐優美子	ティンクルスター2	
いくえみ綾	いくえみ稜	
いとうかなこ	
いとうのいぢ	いとうのいじ	
いまみちともたか	Love_Dynamights	
いわさきちひろ	岩崎ちひろ	
いわしげ孝	岩重孝	
うるし原智志	漆原智志	ダーク・クリムゾン	レジェンド・オブ・レムネア	エイドロン・シャドー	
おおた慶文	
おせんころがし殺人事件	栗田源蔵	
かかずゆみ	
かずといずみ	
かねこはりい	金子はりい	
きうちかずひろ	
きかんしゃトーマス_原作と人形劇	
きくち英一	菊池英一	菊地映一	
きただにひろし	きだたにひろし	
こおろぎさとみ	
すぎやまこういち	椙山浩一	
すずきまゆみ	
つかせのりこ	
つげ義春	
つじあやの	
てらそままさき	てらそま昌紀	寺杣昌紀	
ともさかりえ	渡辺理恵	さかともえり	河原理恵	友坂理恵	
とり・みき	とりみき	
なだいなだ	
なるけみちこ	
はい島邦明	配島邦明	蓜島邦明	
はっとりみつる	
はるき悦巳	
はるな愛	エアあやや	春菜愛	春名愛	大西賢示	
ひし美ゆり子	菱見百合子	
ひびき玲音	
ひろさちや	増原良彦	
ふなつ一輝	
ほしのあき	星野亜希	
まど・みちお	まどみちお	
みうな	斎藤美海	
やなせたかし	
やまだ紫	
やまねあやの	
よしながふみ	
りょう	涼_(女優・ファッションモデル)	
わたせせいぞう	
アイアン・バタフライ	
アイアート・モレイラ	
アイェレット・ゾラー	
アイガルス・カルヴィティス	アイガルス・カルヴィーティス	
アイク・ケベック	
アイク・ターナー	
アイク・ディオグ	
アイク・デイビス	アイク・デービス	
アイザイア・トーマス	アイザイア・ロード・トーマス3世	
アイザイア・バーリン	イザイア・バーリン	
アイザック・C・キッド	アイザック・キッド	
アイザック・アシモフ	アジモフ	アイザック・アジモフ	アシモフ	
アイザック・シェルビー	
アイザック・スターン	
アイザック・スティーブンス	
アイザック・トウシー	
アイザック・トリンブル	
アイザック・ドイッチャー	ドイッチャー	アイザック・ドイチャー	ドイチャー	
アイザック・ニュートン	サー・アイザック・ニュートン	
アイザック・ハル	
アイザック・バシェヴィス・シンガー	
アイザック・バロー	アイザック・バロウ	
アイザック・ブロック	
アイザック・ヘイズ	
アイザック・メリット・シンガー	
アイシュワリヤー・ラーイ	アイシュワリヤ・ライ	
アイスキュロス	
アイスマン	ヒベルナトゥス	エッツィ	
アイス・キューブ	Ice_Cube	
アイス-T	ICE_T	アイスT	アイス・T	Ice-T	Ice_T	
アイタナ・サンチェス＝ギヨン	アイタナ・サンチェス＝ヒホン	
アイタミ・アルティレス	
アイダ・メイ・パーク	
アイダ・ルピノ	
アイテル・フリードリヒ・フォン・プロイセン	ヴィルヘルム・アイテル・フリードリヒ・クリスティアン・カール	
アイトール・ゴンサレス	
アイナー・ヘルツシュプルング	
アイバン・サザランド	
アイベン・アール	
アイマル・スベルディア	アイマール・スベルディア	
アイマン・ザワーヒリー	アイマン・アッ＝ザワーヒリー	アイマン・ザワヒリ	ザワヒリ	
アイモ・カヤンデル	
アイモ・ディアーナ	
アイラ・エーカー	
アイラ・ガーシュウィン	
アイラ・サンキー	
アイラ・フィッシャー	
アイラ・ヘイズ	
アイラ・レムセン	
アイラ・レヴィン	アイラ・レビン	
アイリス・チャン	アイリスチャン	
アイリス・マードック	
アイリス・ロビンソン	
アイリーン・アトキンス	
アイリーン・ウォーノス	
アイリーン・ウッズ	
アイリーン・ガン	
アイリーン・クイン	
アイリーン・グレイ	
アイリーン・シャラフ	
アイリーン・ジョイス	
アイリーン・ダン	
アイリーン・ヒスコック	
アイリーン・ブレナン	
アイリーン・ヘッカート	
アイルトン・セナ	Fの閃光	アイルトン・セナ・ダ・シルバ	Ayrton_Senna	音速の貴公子	アイルトン・セーナ	アイルトンセナ	
アイン・ランド	
アイヴァン・クラール	イヴァン・クラール	イワン・クラール	
アイヴァン・サウスオール	アイバン・サウスオール	
アイヴァン・チャマイエフ	
アイヴァン・モリス	
アイヴァン・ライトマン	アイバン・ライトマン	
アイヴァー・オールチャーチ	
アイヴァー・ジェーバー	
アイヴァー・ノイマン	
アイヴァー・ノヴェロ	
アイヴァー・リチャーズ	I・A・リチャーズ	
アイヴォ・ダールダー	イボ・ダールダー	イヴォ・ダールダー	アイボ・ダールダー	
アイ・アム・ゴースト	
アイーダ・フィールド	
アウグスティヌス	アウレリウス・アウグスティヌス	アウグスチヌス	ヒッポのアウグスティヌス	
アウグステ・カロリーネ・フォン・ブラウンシュヴァイク＝ヴォルフェンビュッテル	
アウグステ・フォン・ヘッセン＝カッセル	オーガスタ・オブ・ヘッセ＝カッセル	
アウグステ・ロイス・ツー・エーベルスドルフ	
アウグステ・ヴィクトリア・フォン・ホーエンツォレルン＝ジグマリンゲン	
アウグスト2世_(ポーランド王)	アウグスト2世	
アウグスト3世_(ポーランド王)	アウグスト3世	
アウグストゥス	オクタビアヌス	オクタヴィアヌス	ガイウス・オクタウィウス・トゥリヌス	ガイウス・ユリウス・カエサル・オクタウィアヌス	オクタウィアヌス	アウグストゥス号	小シーザー	
アウグスト・アレクサンデル・チャルトリスキ	
アウグスト・クント	
アウグスト・ケクレ	フリードリヒ・ケクレ	ケクレ	
アウグスト・コップ_(ホッケー選手)	
アウグスト・セサル・サンディーノ	サンディーノ	アウグスト・サンディーノ	
アウグスト・チャルトリスキ	
アウグスト・ディール	
アウグスト・ハイスマイヤー	
アウグスト・ピノチェト	ピノチェト	アウグスト・ピノチェ	
アウグスト・フェルディナント・メビウス	アウグスト・メビウス	オーギュスト・メビウス	
アウグスト・フォン・マッケンゼン	
アウグスト・ベーベル	
アウグスト・マッケ	
アウグスト・マリッチ	アヴグスト・マリッチ	
アウグスト・モンテローソ	
アウグスト・ロア＝バストス	ロア・バストス	アウグスト・ロア・バストス	
アウグスト・ヴィルヘルム・フォン・プロイセン_(1722-1758)	
アウグスト・ヴィルヘルム・フォン・プロイセン_(1887-1949)	アウグスト・ヴィルヘルム・ハインリヒ・ギュンター・ヴィクトル	
アウグスト・ヴィルヘルム・フォン・ホフマン	
アウゴスト・エナ	
アウダイール	アウダイール・ナシメント・ドス・サントス	
アウドゥン・ボイセン	
アウリス・カラコルピ	
アウレリオ・ゴンサレス	アウレリオ・ゴンザレス	
アウレリオ・ペッチェイ	
アウレリオ・ランプレディ	Aurelio_Lampredi	
アウンサンスーチー	アウン・サン・スー・チー	アウンサン・スーチー	アウン・サン・スーチー	
アウンサン	面田紋次	アウンサン将軍	アウン・サン	
アガサ・クリスティ	クリスティー	アガサ・クリスティー	メアリ・ウェストマコット	アガサクリスティー	クリスティ	
アガト_(ローマ教皇)	
アガーテ・バッケル＝グロンダール	
アガート・ウィリンジイマナ	アガト・ウィリンジイマナ	
アキバルド・モスケラ	
アキル・アキロフ	オキル・オキロフ	
アキレス・プリースター	
アキレス・ヤルビネン	
アキヴァ・ゴールズマン	
アキ・カウリスマキ	アキ・カウリマスキ	
アギネス・ディーン	
アクセリ・ガッレン＝カッレラ	アクセリ・ガッレン・カッレラ	
アクセル・エルベレ	
アクセル・オクセンシェルナ	ウクセンシェルナ	
アクセル・シュプリンガー	アクセル・スプリンガー	
アクセル・メルクス	
アクセル・ルディ・ペル	Axel_Rudi_Pell	Axel_rudi_pell	AXEL_RUDI_PELL	
アクセル・ローズ	Axl_Rose	W._Axl_Rose	
アクバル	
アクフェン	Akufen	
アグスティン・カレリ	
アグスティン・デ・イトゥルビデ	アグスティン1世	
アグスティン・バリオス	アグスティン・ピオ・バリオス	
アグスティン・ムニョス・グランデス	アウグスティン・ムニョス・グランデス	アウグスト・ムノズ＝グランデス	
アグネス・デ＝ミル	
アグネス・ムーアヘッド	
アグネス・ラム	アグネスラム	
アグネッタ・フォルツコグ	
アゴスティニョ・ネト	アゴスチーニョ・ネト	アゴスティーニョ・ネト	
アゴスティーノ・ステッファーニ	
アサファ・パウエル	
アサフ・ホール	
アサン・バザイェフ	アッサン・バザイエフ	アサン・バザイエフ	
アサ・アール・カーター	フォレスト・カーター	
アザリ・アスマニ	アスマニ	
アシャンティ_(歌手)	
アシュカン・デヤガー	アシュカン・デジャガウ	
アシュトン・カッチャー	
アシュラフ・ガニ	アシュラフ・ガニ・アフマドザイ	
アシュラフ・バルフム	
アシュリー・エクスタイン	アシュリー・ドレイン	
アシュリー・グリーン	アシュレイ・グリーン	
アシュリー・コール	
アシュリー・シンプソン	
アシュリー・ヤング	
アシュレイ・ジャッド	アシュレー・ジャッド	アシュレー・ジャド	
アシュレイ・ティスデイル	アシュリー・ティスデール	
アシュレイ・ワグナー	アシュリー・ワグナー	
アシュレー・ジョンソン	
アシーナ・オナシス・デ・ミランダ	アシーナ・オナシス	
アシーナ・カーカニス	
アジウソン・ペレイラ・デ・ソウザ	アジウソン・ペレイラ・デ・ポポ・ソウザ	
アジス・ヤヤ	アジス・ジャジャ	
アジム・イサベコフ	
アジム・プレムジ	
アジャ・コング	アジャコング	宍戸江利花	
アスエリオ・シウバ	
アスカル・アカエフ	アカエフ	
アスガー・ハンメリク	
アストラッド・ジルベルト	
アストリッド・ド・スエード	
アストリッド・リンドグレーン	リンドグレーン	エーミル	山賊のむすめローニャ	アストリット・リンドグレーン	
アストリッド・ヴァルナイ	アストリッド・バルナイ	
アストル・ピアソラ	ピアソラ	
アストン・バレット	ファミリー・マン	ファミリーマン	
アスパシア	
アスパシア・マノス	
アスビョルン・ルート	
アスランチェリイ・トハクシノフ	
アスランベク・ブラツェフ	
アスランベク・ヴァダロフ	
アスラン・アバシゼ	
アスラン・マスハドフ	アスラン・マスハードフ	
アズミ・ビシャラー	
アズラ・スカイ	
アズ・アイ・レイ・ダイング	アズ・アイ・レイ・ダイイング	As_I_Lay_Dying	
アセフ・アシュ＝シャウカト	
アセリノ・フレイタス	アセリノ・フレータス	
アゼリン・デビソン	Aselin_Debison	
アタウアルパ・ユパンキ	アタワルパ・ユパンキ	
アタナシウス・キルヒャー	キルヒャー	アタナジウス・キルヒャー	
アタル・ビハーリー・ヴァージペーイー	バジパイ首相	バジパイ	シリ・アタリ・ビハリ・ワジャパイー	
アダム・イエジィ・チャルトリスキ	アダム・イェジー・チャルトリスキ	アダム・イェジ・チャルトリスキ	
アダム・ウェスト	
アダム・ウォーレン	
アダム・ウラム	
アダム・エルスハイマー	
アダム・オズボーン	
アダム・カジミェシュ・チャルトリスキ	
アダム・ガダーン	アダム・イェヒイェ・ガダーン	
アダム・ガルシア	
アダム・クリーガー	
アダム・クレイトン	
アダム・クーパー	
アダム・コープランド	
アダム・ゴールドバーグ	
アダム・サンドラー	Adam_Sandler	
アダム・サヴェッジ	
アダム・シャール	シャル・フォン・ベル	シャル_・フォン・ベル	アダム・シャル	アダム・シャル・フォン・ベル	湯若望	
アダム・ジョンソン_(サッカー選手)	
アダム・スコット	
アダム・スコット_(俳優)	
アダム・スミス	アダムスミス	
アダム・チェン	
アダム・ビーチ	
アダム・フリーランド	フリーランド	Adam_Freeland	
アダム・ブロディ	
アダム・ボールドウィン	
アダム・ミツキェヴィチ	アダム・ミツキエヴィチ	アダム・ミツキィェーヴィッチ	
アダム・ラパツキ	
アダム・ランバート	
アダム・レヴィーン	
アダム・ワトソン	
アダルベルト・リベラ	
アダン・ド・ラ・アル	
アダ・ヨナス	エイダ・E・ヨナス	アダ・E・ヨナス	エイダ・ヨナス	アダ・ヨナト	ヨナト	
アッカー・ビルク	
アッザッディーン・ララーキー	
アッシジのフランチェスコ	アッシジのフランシスコ	アシジのフランシスコ	ジョヴァンニ・フランチェスコ・ベルナルドーネ	アッシジの聖フランチェスコ	アッシジの聖フランシスコ	ジョバンニ・フランチェスコ・ベルナルドーネ	アシジのフランチェスコ	
アッシャー・ロス	Asher_Roth	
アッシャー_(歌手)	
アッシュール・ナディン・アヘ2世	
アッタロス1世	
アッティカス・ロス	
アッティラ	エッツェル	アッチラ	
アッティラ・イルハン	アッチラ・イルハン	
アッティリオ・パヴェージ	アッティリオ・パヴェジ	
アッバス・エル＝ファッシ	
アッバス・キアロスタミ	
アップル・デ・アップ	
アツミサオリ	
アティラ・カラチ	
アティーヤ・アブド・アル＝ラマーン	
アテナ・チュー	アテナ・チュウ	アテナチュー	アテナチュウ	朱茵	
アディル・ズルフィカルパシッチ	
アディ・シャミア	
アディ・ジョス	
アデマール・ダ・シルバ	
アデミール・マルケス・デ・メネゼス	
アデライド・ラビーユ＝ギアール	
アデリーナ・イスマイリ	
アデルバート・エイムズ	
アデル・ターラブト	アデル・ターラブ	
アデル・ド・サヴォワ	アデライード・ド・サヴォア	アデル・ド・モリエンヌ	アデライド・ド・サヴォワ	アデライード・ド・モリエンヌ	アリックス・ド・モーリエンヌ	アリックス・ド・モリエンヌ	アデール・ド・モリエンヌ	アリックス・ド・サヴォワ	アリックス・ド・サヴォア	アデライード・ド・サヴォワ	アデール・ド・モーリエンヌ	アデル・ド・モーリエンヌ	アデール・ド・サヴォワ	アデライド・ド・モーリエンヌ	アデライド・ド・モリエンヌ	アデライード・ド・モーリエンヌ	アデール・ド・サヴォア	アデライド・ド・サヴォア	アデル・ド・サヴォア	
アデル_(歌手)	
アデレイド・クラプシー	
アデレード・オブ・サクス＝マイニンゲン	
アデン・アブドラ・ウスマン	
アトム・エゴヤン	
アトランティス_(プロレスラー)	
アトル・セルバーグ	アトル・セルバーク	
アト・ボルドン	
アドウェール・アキノエ＝アグバエ	アドウェール・アキノエ・アグバエ	
アドナン・バドラン	
アドナン・メンデレス	
アドニス_(詩人)	アドゥニス	
アドニラム・ジャドソン	
アドニ・マロピス	
アドリアナ・カセロッティ	
アドリアナ・カランブー	
アドリアナ・バラッザ	アドリアナ・バラザ	アドリアナ・バラーザ	
アドリアナ・リマ	
アドリアン・イリエ	
アドリアン・ガジャ	
アドリアン・キヴンビ・ドゥング	
アドリアン・ナスターセ	
アドリアン・フルティガー	エイドリアン・フルティガー	
アドリアン・ムトゥ	
アドリアン・ヴィラールト	ヴィラールト	
アドリアン＝マリ・ルジャンドル	アドリアン＝マリー・ルジャンドル	
アドリアーネ・ガリステウ	
アドリアーノ・シントラ	
アドリアーノ・フェヘイラ・マルティンス	
アドリアーノ・マローリ	アドリアノ・マローリ	
アドリアーン・ブラウ	
アドリアーン・ブラウエル	
アドリエンヌ・クラークソン	伍冰枝	
アドリエンヌ・リッチ	
アドリ・ファンデルプール	アドリ・ファン・デル・プール	アドリ・ファンデルプル	
アドルファス_(ケンブリッジ公)	
アドルフォ・コンソリーニ	
アドルフォ・スアレス	
アドルフォ・チェリ	
アドルフォ・デ・ラ・ウエルタ	アドルフォ・デ・ラ・ウェルタ	
アドルフォ・ニコラス	
アドルフォ・ファルサーリ	
アドルフォ・ペデルネラ	
アドルフ_(ルクセンブルク大公)	アドルフ_(ナッサウ公)	
アドルフ・アイヒマン	アイヒマン	アイヒマン裁判	
アドルフ・アダン	アドルフ・アダム	
アドルフ・アンデルセン	
アドルフ・エリク・ノルデンショルド	ニルス・アドルフ・エリック・ノルデンショルド	A・E・ノルデンショルド	
アドルフ・エングラー	
アドルフ・オイゲン・フィック	Fick	フィック	
アドルフ・ガーランド	アドルフ・ガラント	アドルフ・ガーラント	
アドルフ・グリーン	
アドルフ・ケトレー	ランベール・ケトレー	ランベール・アドルフ・ジャック・ケトレー	ケトレー	
アドルフ・サックス	
アドルフ・ティエール	チェール	アドルフ・チエール	チエール	
アドルフ・ハーセス	
アドルフ・ヒトラー	Adolf_Hitler	ヒトラー生存説	アードルフ・ヒットラー	ヒットレル	ヒトラー	アドルフ・ヒットラー	アドルフ・ヒットレル	ヒットラー	アードルフ・ヒトラー	
アドルフ・ヒューンライン	
アドルフ・フォン・ハルナック	ハルナック	アードルフ・フォン・ハルナック	アドルフ・ハルナック	
アドルフ・フォン・バイヤー	アドルフ・バイヤー	
アドルフ・フリードリヒ・ツー・メクレンブルク	
アドルフ・フルトヴェングラー	
アドルフ・フルヴィッツ	アードルフ・フルヴィッツ	アドルフ・フルウィッツ	
アドルフ・フレドリク・リンドブラード	
アドルフ・ブルガー	
アドルフ・ブーゼマン	
アドルフ・ブーテナント	ブーテナント	
アドルフ・ホイジンガー	
アドルフ・ボリー	アドルフ・エドワード・ボリー	アドルフ・E・ボーリー	アドルフ・E・ボリー	アドルフ・ボーリー	アドルフ・エドワード・ボーリー	
アドルフ・マンジュー	アドルフ・マンジュウ	
アドルフ・ムシュク	
アドルフ・ムーロン・カッサンドル	カッサンドル	
アドルフ・ロース	
アドルフ・ワーグナー_(経済学者)	
アドレー・E・スティーブンソン	
アナイ	
アナイス・ニン	
アナイー・モラン	アネ・モラン	アナイス・モラン	
アナクサゴラス	
アナクシマンドロス	
アナクレトゥス_(ローマ教皇)	アナクレトゥス	
アナスタシア・エルマコワ	
アナスタシア・クズミナ	
アナスタシア・ダビドワ	
アナスタシア・ニコラエヴナ	アナスタシア皇女	アナスタシア・ロマノワ	アナスタシア・ロマノバ	
アナスタシア・ミスキナ	
アナスタシア_(歌手)	
アナスタシオス_(アルバニア大主教)	
アナスタシオ・ソモサ・ガルシア	
アナスタシオ・ソモサ・デバイレ	
アナスタシオ・ブスタマンテ	
アナスタス・ミコヤン	ミコヤン	
アナス・フォー・ラスムセン	
アナトリー・アダムシン	
アナトリー・カルポフ	アナトーリー・カルポフ	
アナトリー・キナフ	
アナトリー・クリコフ	
アナトリー・サプチャーク	
アナトリー・チュバイス	
アナトリー・ドブルイニン	
アナトリー・バニシェフスキー	
アナトリー・フィリプチェンコ	
アナトリー・フォメンコ	
