クリントン・デイヴィソン	クリントン・ディヴィソン	C._J._デーヴィソン	クリントン・ダヴィソン	
クリントン・プレスバ・アンダーソン	クリントン・P・アンダーソン	クリントン・アンダーソン	
クリント・イーストウッド	Clint_Eastwood	
クリント・デンプシー	
クリント・ハワード	
クリント・マンセル	
クリン・ジェルジュ	
クリート・ボイヤー	
クリー・サマー	
クルターグ・ジェルジュ	クルターグ・ジェルジ	クルターグ	ジェルジ・クルターグ	クルターク	ジェルジ・クルターク	
クルトアスル・アルヴェセン	
クルト・アイスナー	
クルト・アイヒホルン	
クルト・アルダー	
クルト・オッペルト	
クルト・クニスペル	
クルト・クリストフ・フォン・シュヴェリーン	
クルト・クーゼンベルク	
クルト・クールマイ	
クルト・ゲオルク・キージンガー	キージンガー	
クルト・ゲルシュタイン	
クルト・ゲーデル	ゲーデル	
クルト・ザンデルリング	クルト・ザンデルリンク	
クルト・シュシュニック	シュシュニック	シューシュニック	シューシュニク	シュシュニク	クルト・フォン・シュシュニク	クルト・シュシュニグ	
クルト・シュヴァーエン	シュヴァーエン	シュヴェーン	クルト・シュヴェーン	
クルト・シュヴィッタース	クルト・シュビッタース	
クルト・シューマッハー	クルト・シューマッハ	
クルト・タンク	
クルト・ダリューゲ	ダリューゲ	
クルト・ツァイツラー	
クルト・トゥホルスキー	
クルト・ニルセン	
クルト・フォン・シュライヒャー	シュライヒャー	
クルト・フォン・ティッペルスキルヒ	
クルト・フォン・ハンマーシュタイン＝エクヴォルト	
クルト・フランツ	クルト・ヒューベルト・フランツ	クルト・フーベルト・フランツ	
クルト・ヘッセンベルク	ヘッセンベルク	
クルト・ヘルツシュタルク	
クルト・ヘンゼル	
クルト・ベック	
クルト・ベーメ	
クルト・マイヤー	
クルト・マズア	クルト・マズーア	マズア	
クルト・ユルゲンス	ユルゲンス	
クルト・ラスヴィッツ	ラスヴィッツ	
クルト・レヴィン	クルト・レウィン	レウィン	
クルト・レーデル	レーデル	
クルト・ワイル	クルト・ヴァイル	カート・ワイル	カート・ウェイル	クルト・ウェイル	
クルト・ヴァルトハイム	クルト・ワルトハイム	
クルト・ヴェス	クルト・ウェス	
クルト・ヴェルター	
クルト・ヴュートリッヒ	
クルマンベク・バキエフ	バキエフ	
クルード・オーキンレック	
クルーノ・ロブレク	
クレア・ウィンザー	
クレア・ウィンザー_(アルスター伯爵夫人)	
クレア・キーガン	
クレア・クレイマー	クレア・クレーマー	
クレア・デインズ	クレア・デーンズ	
クレア・デュヴァル	
クレア・デュ・ブレイ	クレア・デュブレイ	
クレア・トレヴァー	
クレア・パターソン	
クレア・フォーラニ	クレア・フォラーニ	
クレア・ブルーム	
クレア・マッカーデル	
クレア・リー・シェンノート	
クレイグ・アームストロング	
クレイグ・イーストモンド	
クレイグ・エルウッド	
クレイグ・オレジニク	
クレイグ・ガードナー	
クレイグ・ゴードン	
クレイグ・ディクソン	
クレイグ・ビーティ	
クレイグ・ファーガソン	
クレイグ・ブラゼル	
クレイグ・ブリュワー	
クレイグ・ベラミー	
クレイグ・リンドフィールド	
クレイグ・ヴェンター	J・クレイグ・ヴェンター	クレイグ・ベンター	J・クレイグ・ベンター	
クレイグ・T・ネルソン	
クレイトス	
クレイトン・エイブラムス	
クレイトン・キース・ヤイター	クレイトン・ヤイター	クレイトン・K・ヤイター	
クレイトン・ロースン	
クレイボーン・ペル	クレイボーン・デ・ボルダ・ペル	クレイボーン・デ・B・ペル	クレイボン・デ・ボルダ・ペル	クレイボン・B・ペル	クレイボン・デ・B・ペル	クレイボン・ペル	クレイボーン・B・ペル	
クレイ・エイケン	
クレイ・レガツォーニ	Clay_Regazzoni	クレイ・レガッツォーニ	
クレオパトラ7世	クレオパトラ	
クレオパトラ・ストラタン	
クレオ・マディソン	
クレオ・レーン	
クレス・オルデンバーグ	
クレマンス・ポエジー	
クレマンティーヌ・ドルレアン	
クレマン・アデール	
クレム・クレムソン	
クレム・ヒル	
クレメンス10世_(ローマ教皇)	クレメンス10世	
クレメンス11世_(ローマ教皇)	クレメンス11世	
クレメンス12世_(ローマ教皇)	クレメンス12世	
クレメンス13世_(ローマ教皇)	クレメンス13世	
クレメンス14世_(ローマ教皇)	クレメンス14世	
クレメンス1世_(ローマ教皇)	クレメンス1世	ローマのクレメンス	
クレメンス6世_(ローマ教皇)	クレメンス6世	
クレメンス8世_(ローマ教皇)	クレメンス8世	
クレメンス9世_(ローマ教皇)	クレメンス9世	
クレメンス・ウィルヘルム・ヤコブ・メッケル	ヤコブ・メッケル	クレメンス・メッケル	
クレメンス・ブレンターノ	
クレメンス・ヴィンクラー	クレメンス・ウィンクラー	
クレメンタイン・フォード	
クレメンテ・サンチェス	
クレメント・アトリー	アトリー	
クレメント・グリーンバーグ	
クレメント・ゴットワルト	クレメント・ゴットヴァルド	クレメント・ゴットワルド	
クレメント・スラヴィツキー	スラヴィツキー	
クレメント・ハード	Clement_Hurd	
クレルヴォーのベルナルドゥス	ベルナルドゥス	クレルヴォーのベルナール	
クレール・ケーム	
クレール・ジボー	
クレール・デルボス	
クレール・ドニ	
クレー・アリソン	
クロエ_(ポルノ女優)	
クロエ・アグニュー	Chloe_agnew	
クロエ・カーダシアン	
クロエ・グレース・モレッツ	クロエ・モレッツ	
クロエ・セヴィニー	
クロエ・マーシャル	
クロタール1世	
クロディーヌ・ロンジェ	
クロフォード・マレー・マクレホース	
クロミー・マッキャンドレス	
クロリス・リーチマン	
クロンファートのブレンダン	
クロンベルガー・リリー	リリー・クロンベルガー	
クロヴィス1世	クローヴィス1世	
クローダン・ド・セルミジ	セルミジ	
クローディア・ミッチェル	
クローディ・エニュレ	
クローディーヌ・オージェ	
クローデット・コルベール	
クロートヴィヒ・ツー・ホーエンローエ＝シリングスフュルスト	クロートヴィヒ・ツー・ホーエンローエ・シリングスフュルスト	クロードヴィヒ・ツー・ホーエンローエ＝シリングスフュルスト	クロードヴィヒ・ツー・ホーエンローエ・シリングスフュルスト	ホーエンローエ＝シリングスフュルスト	ホーエンローエ・シリングスフュルスト	
クロード・イーザリー	
クロード・エルフェ	
クロード・エヴァン	
クロード・オータン＝ララ	クロード・オータン・ララ	
クロード・ゴレッタ	
クロード・シェソン	
クロード・シモン	
クロード・シャノン	クロード・エルウッド・シャノン	
クロード・シャブロル	
クロード・シュヴァレー	
クロード・ジャド	
クロード・スワンソン	クロード・オーガスタス・スワンソン	クロード・A・スワンソン	
クロード・ソーテ	
クロード・デイヴィス	
クロード・ドビュッシー	ドビュッシー	クロード・アシル・ドビュッシー	ドビッシー	Debussy	
クロード・ド・ジヴレー	
クロード・ド・フランス	
クロード・ド・ヴァロワ	
クロード・ニコラ・ルドゥー	
クロード・バウエス＝ライオン_(第14代ストラスモア伯爵)	クロード・ジョージ・バウエス＝ライオン_(第14代ストラスモア伯爵)	
クロード・ベリ	
クロード・ペロン	
クロード・マケレレ	マケレレ	
クロード・メナール	
クロード・モネ	
クロード・モーリアック	
クロード・ランズマン	
クロード・ルイ・マチュー	
クロード・ルフォール	
クロード・ルルーシュ	
クロード・ル・ジュヌ	ルジュヌ	クロード・ルジュヌ	ル・ジュヌ	
クロード・レインズ	
クロード・レヴィ＝ストロース	レビ＝ストロース	レヴィストロース	レヴィ・ストロース	レヴィ＝ストロース	
クロード・E・ロビンソン	
クワミ・ブラウン	
クワメ・エンクルマ	クワメ・ンクルマ	ンクルマ	エンクルマ	
クンバ・ヤラ	
ク・ヘソン	
クーノ・フィッシャー	クノー・フィッシャー	クーノー・フィッシャー	
クーノ・ホフマイスター	
クーピク・クライスト	
クーリオ	Coolio	
クール・ハーク	クールハーク	
クール・パパ・ベル	
グァルティエロ・ヤコペッティ	ヤコペッティ	
グアダルーペ・ビクトリア	
グィネヴィア・ターナー	
グィード・カンテッリ	グィド・カンテルリ	
グイティー・ノーヴィン	グイティー_ノーヴィン	
グイド・クレパックス	グィド・クレパクス	
グイド・ボナッティ	
グイド・レオーニ	
グイド・レーニ	グイド・レニ	
グイド・ヴァンロッサム	グイド・ヴァン・ロッサム	
グイン・スミス	
グウィネス・パルトロー	グウィネス・パルトロウ	
グウェンドリン・ヨー	グウェンダリン・ヨー	
グウェン・ステファニー	
グエン・カーン	
グエン・ゴク・ロアン	
グエン・タン・ズン	阮晋勇	
グエン・バン・チュー	グエン・ヴァン・チュー	チュー	グエン・バン・ティエウ	
グエン・フー・ト	グエン・フー・トー	
グエン・ミン・チェット	
グエン・ヴァン・アン	
グエン・ヴァン・カオ	グエン・バン・カオ	
グザビエ・マリス	ザビエル・マリッセ	
グザヴィエ・ダルコス	
グザヴィエ・ドゥ・ラ・リュー	
グザヴィエ・フパ＝ポカム	グザヴィエ・フパ・ポカム	ザビアー・フォウパ・ポカム	グザビィエ・フーパ＝ポカン	シャビエル・フパ＝ポカム	
グザヴィエ・ベルトラン	
グザヴィエ・ボーヴォワ	
グザヴィエ・ル・ピション	グザビエ・ル・ピション	
グスタフ1世_(スウェーデン王)	グスタヴ・ヴァーサ	グスタフ・ヴァーサ	グスタフ1世	
グスタフ5世_(スウェーデン王)	グスタフ5世	
グスタフ_(ヴァーサ公)	ヴァーサ公	
グスタフ・イェナー	
グスタフ・カッセル	カール・グスタフ・カッセル	
グスタフ・キルヒホフ	グスターブ・キルヒホッフ	グスターヴ・キルヒホッフ	グスターフ・ロベルト・キルヒホッフ	グスタフ・キルヒホッフ	
グスタフ・ギルバート	
グスタフ・クヌート	
グスタフ・クリムト	クリムト	
グスタフ・シュトレーゼマン	シュトレーゼマン	
グスタフ・ジーモン	グスタフ・ジモン	
グスタフ・ナハティガル	
グスタフ・ノスケ	
グスタフ・ハイネマン	ハイネマン	
グスタフ・ハスフォード	
グスタフ・バウアー	
グスタフ・フェヒナー	フェヒナー	
グスタフ・フォン・カール	グスタフ・リッター・フォン・カール	
グスタフ・フォン・シュモラー	シュモラー	グスタフ・シュモラー	
グスタフ・ヘルツ	グスタフ・ルートヴィヒ・ヘルツ	
グスタフ・マイリンク	
グスタフ・マーラー	Mahler	
グスタフ・ヤンション	
グスタフ・レオンハルト	Leonhardt	
グスタフ・レーデル	
グスタフ・ワーグナー	グスタフ・フランツ・ワグナー	グスタフ・ワグナー	グスタフ・フランツ・ワーグナー	
グスタフ＝アドルフ・シューア	
グスタボ・グティエレス	グスタヴォ・グティエレス	
グスタボ・セサル	
グスタヴス・ウッドソン・スミス	グスタヴス・スミス	G・W・スミス	
グスタヴ・ラルソン	グスタフ・ラーション	グスタヴ・エリック・ラルソン	グスタフ・エリック・ラーション	
グスターフ・フサーク	フサーク	グスタフ・フサーク	
グスターボ・サンタオラヤ	
グスターヴ・ホワイトヘッド	グスタフ・ヴァイスコプフ	
グッチ・メイン	Gucci_Mane	
グッドラックチャーリー	グッドラック・チャーリー	グッド・ラック・チャーリー	
グッドラック・ジョナサン	
グナエウス・ポンペイウス	ポンペイウス	グナエウス・ポンペイウス・マグヌス	ポンペイウス・マグヌス	大ポンペイウス	
グラジナ・バツェヴィチ	バセビッチ	バツェヴィチ	バツェヴィッチ	バセヴィチ	バツェビッチ	バセヴィッチ	
グラツィア・デレッダ	デレッダ	グラーツィア・デレッダ	
グラディス・クーパー	
グラディス・ナイト	グラディス・ナイト&amp;ザ・ピップス	グラディス・ナイト&amp;ピップス	
グラディス・ミッチェル	
グラハム・グリーン	
グラハム・スタック	
グラハム・ナッシュ	グレアム・ナッシュ	
グラハム・ハンコック	グレアム・ハンコック	グラハムハンコック	
グラハム・ヒル	Graham_Hill	グレアム・ヒル	
グラハム・ヘンリー	
グラハム・ボネット	Graham_Bonnet	
グラム・パーソンズ	
グラム・ファルク・ヤクビ	
グラレアヌス	ハインリッヒ・グラレアン	ハインリヒ・グラレアヌス	
グラント・イマハラ	
グラント・ウッド	
グラント・グリーン	
グラント・ヘスロヴ	
グランマ・モーゼス	モーゼスおばあさん	モーゼスおばあちゃん	
グラン浜田	リトル・ラブ・マシン	浜田広秋	ミニ・ラブ・マシン	
グリア・ガースン	グリア・ガーソン	
グリエルモ・マルコーニ	G._マルコーニ	
グリゴラシュ・ディニク	ディニク	
グリゴリー・ギンズブルク	
グリゴリー・クリーク	
グリゴリー・シュテルン	
グリゴリー・ソコリニコフ	ソコリニコフ	
グリゴリー・ペレルマン	グレゴリー・ペレルマン	グリゴリー・ペレリマン	
グリゴリー・ヤブリンスキー	グリゴリー・ヤヴリンスキー	
グリゴリー・ラスプーチン	ラスプーチン	グレゴリー・ラスプーチン	
グリゴリー・ラポータ	
グリゴリー・ロマノフ	
グリゴル・ムガロブリシュヴィリ	ムガロブリシュヴィリ	グリゴル・ムガロブリシビリ	グリゴル・ムガロブリシヴィリ	ムガロブリシビリ	ムガロブリシヴィリ	グリゴリ・ムガロブリシヴィリ	
グリナラ・カリモヴァ	グリナラ・カリモフ	
グリフィン・ダン	
グリュコーザ	
グリーンリーフ・ホイッティア・ピカード	
グルバングル・ベルディムハメドフ	ベルドイムハメドフ	
グルブッディーン・ヘクマティヤール	
グル_(ラッパー)	キース・イラム	キース・エラム	キース・エドワード・イーラム	キース・イーラム	キース・エドワード・イラム	
グル・ダット	
グル・モハメッド	
グレアム・アレクサンダー	グラハム・アレクサンダー	
グレアム・グリーン	
グレアム・グールドマン	
グレアム・スーネス	
グレアム・チャップマン	グラハム・チャップマン	
グレアム・パーカー	グラハム・パーカー	
グレアム・ヤング	
グレイス・キュナード	グレイス・キューナード	
グレイス・ザブリスキー	
グレイス・ジョーンズ	グレース・ジョーンズ	
グレイス・スリック	
グレイソン・チャンス	
グレイヴ・ディガー	
グレイ・デリスル	グレイ・デライル	
グレガ・ボレ	
グレグ・ペイジ	グレグ・ページ	グレッグ・ペイジ	
グレゴリウス13世_(ローマ教皇)	グレゴリウス13世	グレコリウス13世	グレゴリオ13世	
グレゴリウス14世_(ローマ教皇)	グレゴリウス14世	
グレゴリウス15世_(ローマ教皇)	グレゴリウス15世	
グレゴリウス16世_(ローマ教皇)	グレゴリウス16世	
グレゴリウス7世_(ローマ教皇)	グレゴリウス7世	
グレゴリオ・ブラスコ	
グレゴリオ・ベニト	
グレゴリー・アイザックス	
グレゴリー・ウォルコット	
グレゴリー・シーラ	
グレゴリー・ダーク	
グレゴリー・チャイティン	チャイティン	グレゴリー・チェイティン	
グレゴリー・ハインズ	
グレゴリー・ヘルムズ	
グレゴリー・ベイトソン	
グレゴリー・ベンフォード	グレゴリイ・ベンフォード	
グレゴリー・ペック	
グレゴリー・ボイントン	
グレゴリー・マルグリス	
グレゴリー・マンキュー	マンキュー	N・G・マンキュー	N・グレゴリー・マンキュー	
グレゴリー・ラスト	
グレゴワール・カイバンダ	グレゴイール・カイバンダ	
グレゴール・ピアティゴルスキー	グレガー・ピアティゴルスキー	ピアティゴルスキー	
グレゴール・ヨハン・メンデル	グレゴール・メンデル	メンデル	
グレタ・ガルボ	
グレタ・スカッキ	
グレッグ・アラキ	
グレッグ・イーガン	
グレッグ・エリス	
グレッグ・オデン	グレッグ・オーデン	
グレッグ・オールマン	
グレッグ・キニア	
グレッグ・グランバーグ	
グレッグ・コーエン	
グレッグ・サイプス	
グレッグ・ジャーマン	
グレッグ・トーランド	
グレッグ・ハウ	
グレッグ・バレンタイン	フォン・エリック・ファミリー	
グレッグ・バーガー	
グレッグ・バージ	
グレッグ・バーンセン	
グレッグ・パティロ	
グレッグ・ビソネット	
グレッグ・ビッフル	
グレッグ・ヘンダーソン	グレゴリー・ヘンダーソン	
グレッグ・ベア	
グレッグ・モットーラ	グレッグ・モトーラ	
グレッグ・ランドリー	
グレッグ・レイク	Greg_Lake	
グレッチェン・モル	
グレテ・ソンク	
グレナード・P・リプスコム	
グレンダ・ジャクソン	
グレンビル・ドッジ	
グレン・アダムス	
グレン・エドガー・エジャートン	
グレン・カニンガム	
グレン・カーチス	グレン・カーティス	
グレン・キーン	
グレン・クイン	
グレン・クローズ	グレン・クロース	
グレン・グールド	
グレン・シャディックス	
グレン・シーボーグ	シーボーグ	
グレン・ジェイコブズ	ケイン_(プロレスラー)	
グレン・ジョンソン	
グレン・ジョーンズ	
グレン・スティーヴンス	
グレン・ダンジグ	
グレン・ティプトン	
グレン・ハーディン	
グレン・ヒューズ	
グレン・フォード	
グレン・フライ	
グレン・ヘドリー	
グレン・ミラー	
グレン・メデイロス	グレン・メディロス	
グレン・モーシャワー	
グレン・S・フクシマ	グレン・フクシマ	
グレース・ウィリアムズ	
グレース・ケリー	グレイス・ケリー	
グレース・チャン	
グレース・パク	グレイス・パーク	グレイス・パク	グレース・パーク	
グレース・ベデル	
グレース・ホッパー	
グレース・ミラベラ	
グレーム・クロスビー	
グレーム・ブラウン	
グロシチ・ジュラ	ジュラ・グロシチ	
グロバー・クリーブランド	グローヴァー・クリーヴランド	グローバー・クリーブランド	グロヴァー・クリーヴランド	
グロリア・アロヨ	グロリア・マカパガル・アロヨ	
グロリア・イップ	
グロリア・エステファン	マイアミ・サウンド・マシーン	
グロリア・カッツ	
グロリア・グレアム	
グロリア・スタイネム	
グロリア・スチュアート	
グロリア・スワンソン	
グロリア・ヘンドリー	
グロリア・モーガン・ヴァンダービルト	
グロリア・ルーベン	グロリアルーベン	
グロリア_(歌手)	
グロ・ハーレム・ブルントラント	グロ・ハーレム・ブルントランド	グロ・ハルレム・ブルントラント	グロ・ハーレム・ブルントラン	
グロート・レーバー	グロート・リーバー	
グローブ・カール・ギルバート	グローヴ・カール・ギルバート	
グワァー	
グンター・フォン・ハーゲンス	
グンナル・アンデシェン	
グンナル・デ・フルメリー	デ・フルメリー	フルメリー	グンナル・デ・フルメリ	デ＝フルメリー	デ・フルメリ	フルメリ	
グンナール・アスプルンド	アスプルンド	
グンナール・ビョルンストランド	
グンナー・グレン	
グンナー・ニルソン	Gunnar_Nilsson	
グンナー・ノルダール	
グンナー・ヘッケルト	
グンナー・ミュルダール	カール・グンナー・ミュルダール	ミュルダール	
グンナー・ヨハンセン	
グーシ・ハーン	グシ・ハン	グシハン	
グース・ゴスリン	
グーセゴルツ・フィリポフスキー	
グードルン・パウゼヴァング	グードルン・パウゼバング	グドゥルン・パウゼヴァング	グードルン・パウゼバンク	
ケイオス_(ラッパー)	K-os	
ケイコ・アジェナ	
ケイシャ・キャッスル＝ヒューズ	
ケイシー・アフレック	
ケイシー・シーマツコ	
ケイシー・ジョンソン	
ケイシー・ロジャース	
ケイティ・キャシディ	
ケイティ・クーリック	ケーティ・クーリック	ケーティー・クーリック	ケイティー・コーリック	ケイティ・コーリック	ケイティー・クーリック	ケーティー・コーリック	ケーティーコーリック	ケーティ・コーリック	
ケイティ・ペリー	Katy_Perry	
ケイティ・ホームズ	ケイト・ホームズ	
ケイティ・マクグラス	ケイティー・マクグラス	
ケイティ・メルア	
ケイティ・リューング	ケイティ・ラング	
ケイティー・サッコフ	
ケイディー・ストリックランド	
ケイトリン・アシュレイ	
ケイトリン・テイラー・ラブ	ケイトリン・テイラー・ラヴ	
ケイト・アレン	
ケイト・ウィルヘイム	
ケイト・ウィンスレット	ケイト・ウィンズレット	
ケイト・ウォルシュ_(女優)	
ケイト・キャプショー	ケート・キャプショー	
ケイト・ショパン	
ケイト・ジャクソン	Kate_Jackson	
ケイト・スミス	
ケイト・ダグラス・ウィギン	
ケイト・ディカミロ	
ケイト・ノタ	
ケイト・ハドソン	
ケイト・バーカー	
ケイト・ブッシュ	Kate_Bush	
ケイト・ブランシェット	
ケイト・ベッキンセイル	ケイト・ベッキンセール	Kate_Beckinsale	
ケイト・ボスワース	
ケイト・マルグルー	
ケイト・マーラ	ケイト・マラ	
ケイト・モス	
ケイト・ラズビー	
ケイリー・エルウィス	ケーリー・エルウィス	ケイリー・エルウェズ	ケイリー・エルウィズ	ケイリー・エルウェス	
ケイリー・クオコ	ケーリー・クオコ	
ケイリー＝ヒロユキ・タガワ	ケリー・ヒロユキ・タガワ	
ケイレブ・クッシング	サレブ・クッシング	カレブ・カッシング	キャレブ・カッシング	サレブ・カッシング	キャレブ・クッシング	ケイレブ・カッシング	カレブ・クッシング	
ケイレブ・ストロング	
ケイレブ・ブラッド・スミス	キャレブ・スミス	カレブ・ブラッド・スミス	カレブ・B・スミス	カレブ・スミス	キャレブ・B・スミス	ケイレブ・スミス	カルブ・B・スミス	キャレブ・ブラッド・スミス	ケイレブ・B・スミス	
ケイン・コスギ	ケインコスギ	
ケイヴ・ジョンソン	ケーヴ・ジョンソン	ケーブ・ジョンソン	ケイブ・ジョンソン	
ケイ・ケンドール	
ケイ・スタマーズ	
ケイ・セージ	ケイ・セイジ	
ケイ・パナベイカー	
ケイ・フランシス	
ケイ・ルーク	
ケイ慧娜	刑慧娜	邢慧娜	
ケシャ	Ke$ha	キーシャ	Kesha	
ケティ・フラド	
ケナン・エヴレン	
ケニオン・マーティン	ケニヨン・マーティン	
ケニー・オルテガ	
ケニー・カークランド	
ケニー・クァン	關智斌	
ケニー・ジョーンズ	Kenney_Jones	
ケニー・ドリュー	
ケニー・ドーハム	
ケニー・バレル	
