ディエゴ・ウリッシ	
ディエゴ・オルティス	
ディエゴ・コラレス	
ディエゴ・コリャード	
ディエゴ・コロン	
ディエゴ・ファッブリ	ディエゴ・ファブリ	
ディエゴ・ベラスケス	ディエゴ・ロドリゲス・デ・シルバ・イ・ベラスケス	
ディエゴ・ベラスケス・デ・クエリャル	ディエゴ・ベラスケエス	
ディエゴ・マラドーナ	
ディエゴ・ミリート	ディエゴ・ミリト	
ディエゴ・リベラ	
ディエゴ・ルガーノ	ディエゴ・ルガノ	
ディエゴ・ルナ	
ディオメデス・オリーボ	ディオメデス・オリボ	
ディキシー・ディーン	ディクシー・ディーン	
ディケンベ・ムトンボ	ムトンボ	
ディジー・ガレスピー	
ディジー・ディーン	
ディジー・ラスカル	
ディジー・リード	
ディス・プラン	
ディタ・フォン・ティース	ディータ・ヴォン・ティース	
ディッキー・チャペル	
ディッキー・デイル	
ディッキー・ベッツ	
ディック・アドフォカート	
ディック・アレン_(野球)	
ディック・キング＝スミス	
ディック・クラーク	
ディック・サビット	リチャード・サビット	
ディック・スチュアート	
ディック・スレーター	
ディック・チェイニー	チェイニー	リチャード・ブルース・チェイニー	リチャード・B・チェイニー	リチャード・チェイニー	
ディック・デイル	
ディック・ハウザー	
ディック・ハットン	
ディック・バトン	リチャード・バトン	
ディック・パウエル	
ディック・フォスベリー	リチャード・ダグラス・フォスベリー	デック・フォズベリー	
ディック・フランシス	リチャード・スタンレー・フランシス	
ディック・ブルーナ	
ディック・マグワイア	
ディック・マークス	
ディック・マーティン	
ディック・マードック	
ディック・メリル	
ディック・ヨーク	
ディック・ランディー	ディック・ランディ	
ディック・リー	Dick_Lee	DICK_LEE	
ディック・ワグナー	
ディック・ヴァン・ダイク	ディック・バン・ダイク	
ディック東郷	巌鉄魁	
ディット・クラッパー	
ディディエ・ディガール	
ディディエ・デシャン	
ディディエ・ドログバ	ディディエ・ドロバ	ドログバ	
ディディエ・ビュルカルテ	
ディディエ・ピローニ	Didier_Pironi	
ディナム・ヴィクトール・フューメ	ディナム・ヴィクトル・フュメ	
ディナラ・サフィナ	サフィーナ	ディナーラ・サフィーナ	D・サフィーナ	
ディナ・メイヤー	
ディニー・ペイルズ	
ディヌ・リパッティ	リパッティ	
ディノ・ゾフ	ディーノ・ゾフ	
ディノ・デ・ラウレンティス	ディノ・デラウレンティス	ディーノ・デ・ラウレンティス	ラウレンティス	ディーノ・デ・ラウレンティース	
ディノ・メルリン	
ディビッド・ブルー	
ディペンドラ・ビール・ビクラム・シャー・デーヴ	ディペンドラ	
ディミタル・ズラタノフ	
ディミタル・ペネフ	
ディミタール・ベルバトフ	ベルバトフ	
ディミトリオス1世_(コンスタンディヌーポリ総主教)	
ディミトリオス・ディアマンティディス	
ディミトリス・スグロス	
ディミトリス・ドラガタキス	ドラガタキス	
ディミトリス・フリストフィアス	
ディミトリ・カルロス・ゾジマル	
ディミトリ・コニシェフ	
ディミトリ・ザイキン	
ディミトリ・シャンピオン	
ディミトリ・ティオムキン	ディミトリー・ティオムキン	ドミトリ・ティオムキン	ドミトリー・ティオムキン	ティオムキン	
ディラン&コール・スプラウス	ディラン・スプローズ	コール・スプラウス	コール・スプローズ	ディラン・スプラウス	
ディラン・ウォルシュ	
ディラン・ティチェナー	
ディラン・トマス	ディラン・トーマス	
ディラン・ベイカー	
ディラン・マクダーモット	
ディラン・モーラン	
ディルク・カイト	
ディルク・ニーベル	
ディルク・ブラウワー	
ディルク・ボウツ	ディーリック・バウツ	ディルク・バウツ	ディーリック・ボウツ	
ディレイタ・モハメド・ディレイタ	ディレタ・モハメド・ディレタ	
ディンニェーシュ・ラヨシュ	
ディンムハメッド・クナーエフ	
ディヴァイン	
ディーア	ジョンディアー	ジョンディア	ディーア&amp;カンパニー	ジョンディーア	ディーア・アンド・カンパニー	
ディーコン・ホワイト	
ディーター・ツェヒリン	
ディーター・ボーレン	
ディーター・ヴィスリツェニー	
ディートリッヒ・ボンヘッファー	ボンヘッファー	ディートリヒ・ボンヘファー	ディートリヒ・ボンヘッファー	
ディートリヒ・フィッシャー＝ディースカウ	フィッシャー＝ディースカウ	Dietrich_Fischer-Dieskau	ディースカウ	ディートリヒ・フィッシャー・ディースカウ	フィッシャー・ディースカウ	
ディートリヒ・フォン・コルティッツ	
ディートリヒ・フラバク	
ディーナ・タイラー	
ディーノ・カザレス	
ディーノ・グランディ	
ディーノ・ブッツァーティ	ブッツァーティ	
ディーノ・リージ	ディノ・リージ	
ディーパ・メータ	
ディーピカー・パードゥコーン	ディーピカ・パドゥコーネラ	ディーピカ・パドゥコーネ	
ディープ・ロイ	
ディープ・ン	呉浩康	
ディーロ・ブラウン	
ディーン・アシュトン	
ディーン・アチソン	ディーン・G・アチソン	
ディーン・ウィンタース	
ディーン・カンディ	
ディーン・ケイン	ディーン・ジョージ・タナカ	ディーン・ジョージ・田中	ディーン・ケーン	
ディーン・ケーメン	ディーン・カーメン	
ディーン・ジョーンズ	
ディーン・ストックウェル	
ディーン・セキ	
ディーン・セムラー	
ディーン・ディクソン	
ディーン・デュボア	
ディーン・デヴリン	ディーン・デブリン	
ディーン・マーティン	
ディーン・ラスク	ディーン・ロスク	
ディーン・R・クーンツ	ディーン・クーンツ	
ディー・ウォレス・ストーン	
ディー・ディー・ブリッジウォーター	
ディー・ブラッドリー・ベイカー	
デイジー&ヴァイオレット・ヒルトン姉妹	デイジー・ヒルトン、ヴァイオレット・ヒルトン姉妹	
デイナ・スコット	
デイビット・ケリー	
デイビッド・アイク	デービッド･アイク	
デイビッド・アッテンボロー	
デイビッド・ウースター	
デイビッド・グレッグ	
デイビッド・グロス	デイビッド・ジョナサン・グロス	デイビッド・J・グロス	デビッド・グロス	デービッド・グロス	デイヴィッド・J・グロス	デービット・グロス	
デイビッド・グーディス	
デイビッド・コッテリル	
デイビッド・ディクソン・ポーター	
デイビッド・ハンター	
デイビッド・パターソン	デービッド・A・パターソン	
デイビッド・ブラウン_(宇宙飛行士)	
デイビッド・ラック	デイヴィッド・ラック	
デイビッド・ラムゼイ	
デイビー・ジョーンズ	デイヴィー・ジョーンズ	
デイビー・ロープス	デービー・ロープス	デービー・ロペス	
デイブ・キャスパー	デイヴ・キャスパー	デーブ・キャスパー	
デイブ・クーリエ	デイヴ・クーリアー	デイブ・クーリアー	デイヴ・クーリエ	デヴィッド・デイヴ・リー・クーリエ	
デイブ・スチュワート_(野球)	
デイブ・ニーハウス	
デイブ・ハーマン	デイヴ・ハーマン	
デイブ・ビン	デーブ・ビング	
デイブ・ブッシュ	デーブ・ブッシュ	
デイブ・ロバーツ	デーブ・ロバーツ	
デイモン・ヒル	Damon_Hill	デーモン・ヒル	
デイモン・ラニアン	
デイル・アーンハート	デイル・アーンハート・シニア	
デイル・ダイ	
デイル・チフーリ	
デイル・ラッセル	デール・ラッセル	
デイヴィス・フィニー	
デイヴィダス・チェスナウスキス	
デイヴィッド1世_(スコットランド王)	デビッド1世	
デイヴィッド2世_(スコットランド王)	
デイヴィッド・アクセルロッド_(政治コンサルタント)	
デイヴィッド・アンダース	
デイヴィッド・アーモンド	
デイヴィッド・アーヴィング	デイヴィット・アーヴィング	
デイヴィッド・イーストン	デイビッド・イーストン	
デイヴィッド・エディングス	
デイヴィッド・エーデルスタット	デイビッド・エーデルスタット	ドヴィド・エデルシュタット	
デイヴィッド・オーズベル	デイヴィッド・オースーベル	
デイヴィッド・カイル	
デイヴィッド・カヴァデール	デヴィッド・カヴァデール	デビッド・カバーデイル	David_Coverdale	デヴィット・カヴァデール	デヴィッド・カヴァーディル	デイヴィッド・カヴァーデイル	
デイヴィッド・ガーネット	
デイヴィッド・キャス	
デイヴィッド・ギャレット	
デイヴィッド・ギリングハム	
デイヴィッド・クロケット	ディビー・クロケット	デイヴィー・クロケット	デヴィー・クロケット	デヴィッド・クロケット	デビー・クロケット	デイビッド・クロケット	
デイヴィッド・グロスマン	ダヴィド・グロスマン	
デイヴィッド・ケラーマン	デヴィッド・ケラーマン	デビッド・ケラーマン	
デイヴィッド・ゲール	デヴィッド・ゲール	デイビッド・ゲール	デビッド・ゲール	
デイヴィッド・サンボーン	デイビッド・サンボーン	デイビッドサンボーン	デヴィッド・サンボーン	David_Sanborn	デビッド・サンボーン	デイビット・サンボーン	
デイヴィッド・シュラム_(天体物理学者)	
デイヴィッド・シンガー	
デイヴィッド・ジェイン・ヒル	デビッド・ジェーン・ヒル	デイビッド・ジェイン・ヒル	デヴィッド・ジェイン・ヒル	デビッド・ジェイン・ヒル	デイビッド・J・ヒル	デイヴィッド・ジェーン・ヒル	デビッド・J・ヒル	デヴィッド・J・ヒル	デヴィッド・ジェーン・ヒル	デイヴィッド・J・ヒル	デイビッド・ジェーン・ヒル	
デイヴィッド・ジンマン	デーヴィッド・ジンマン	
デイヴィッド・ステンストローム	
デイヴィッド・ストックデイル	
デイヴィッド・ダイアモンド	
デイヴィッド・チューダー	デヴィッド・チュードア	ディヴィッド・チューダー	デヴィッド・テュードア	
デイヴィッド・ディンキンズ	デイヴィッド・ディンキンス	デイヴィド・ディンキンス	
デイヴィッド・トッド_(政治家)	
デイヴィッド・トマス・ケネディ	
デイヴィッド・トンプソン_(バルバドスの政治家)	
デイヴィッド・ドゥカヴニー	デイヴィッド・デュカヴニー	デイビッド・ドゥカブニー	デビッド・ドゥカブニー	
デイヴィッド・ドゥビンスキー	ダヴィド・ドゥブニェフスキ	
デイヴィッド・ナイツ	
デイヴィッド・ニューマン_(脚本家)	
デイヴィッド・ハルバースタム	D・ハルバースタム	デビッド・ハルバースタム	デーヴィド・ハルバースタム	デービッド・ハルバースタム	デイビッド・ハルバースタム	
デイヴィッド・ハンド_(映画監督)	
デイヴィッド・バトラー	デヴィッド・バトラー	
デイヴィッド・ヒューストン	デヴィッド・F・ヒューストン	デイヴィッド・F・ヒューストン	デイヴィッド・フランクリン・ヒューストン	
デイヴィッド・ヒューベル	デビッド・ハンター・フーベル	
デイヴィッド・ヒューム	デビット・ヒューム	ディビット・ヒューム	ディヴィッド・ヒューム	
デイヴィッド・ヒリアード	デイビッド・ヒリアード	
デイヴィッド・フォスター	デビット・フォスター	デヴィッド・フォスター	デイビッド・フォスター	デヴッド・フォスター	David_Foster	デイヴィット・フォスター	デビッド・フォスター	
デイヴィッド・フローリー	
デイヴィッド・ブラウン_(映画プロデューサー)	デイヴィッド・ブラウン	
デイヴィッド・ブリン	デイビッド・ブリン	デヴィッド・ブリン	
デイヴィッド・ヘルフゴット	デイビッド・ヘルフゴット	ヘルフゴット	ディヴィッド・ヘルフゴット	ディビッド・ヘルフゴット	デヴィッド・ヘルフゴット	デビッド・ヘルフゴット	
デイヴィッド・ヘンショウ	デビッド・ヘンショー	デビッド・ヘンショウ	デヴィッド・ヘンショウ	デイビッド・ヘンショー	デイヴィッド・ヘンショー	デヴィッド・ヘンショー	デイビッド・ヘンショウ	
デイヴィッド・ベニオフ	デヴィッド・ベニオフ	
デイヴィッド・ベノワ	デイビッド・ベノア	デヴィッド・ベノア	デビッド・ベノワ	デビッド・ベノア	デイビット・ベノア	デイヴィッド・ベノア	デイビッド・ベノワ	デヴィッド・ベノワ	
デイヴィッド・ホックニー	デビッド・ホックニー	ホックニー	ディヴィッド・ホックニー	
デイヴィッド・マスランカ	
デイヴィッド・マッケンドリー・キー_(外交官)	
デイヴィッド・マッケンドリー・キー_(郵政長官)	
デイヴィッド・ミラー_(政治学者)	
デイヴィッド・ミリバンド	
デイヴィッド・モイーズ	デビッド・モイーズ	デイビッド・モイーズ	デヴィッド・モイーズ	ディヴィッド・モイーズ	
デイヴィッド・ラクシン	デヴィッド・ラクシン	ラクシン	
デイヴィッド・ラパポート	ラパポルト・ダーヴィド	
デイヴィッド・ラヴァリング	デイヴィット・ラヴァリング	
デイヴィッド・リヴィングストン	デイビッド・リヴィングストン	デビッド・リヴィングストン	デヴィッド・リヴィングストン	デヴィッド・リビングストン	デイヴィッド・リビングストン	デービッド・リビングストン	デービット・リヴィングストン	デビッド・リビングストン	デイビッド・リビングストン	ディヴィッド・リヴィングストン	
デイヴィッド・リースマン	デヴィッド・リースマン	デイビッド・リースマン	デーヴィッド・リースマン	リースマン	デビッド・リースマン	デービッド・リースマン	
デイヴィッド・リー・ロス	
デイヴィッド・レターマン	デヴィッド・レターマン	
デイヴィッド・ロックフェラー	デヴィッド・ロックフェラー	デイビッド・ロックフェラー	デーヴィッド・ロックフェラー	デービッド・ロックフェラー	
デイヴィッド・ロッジ	
デイヴィッド・ヴァン・ヴァクター	ヴァン・ヴァクター	ヴァクター	
デイヴィッド・ヴィッター	
デイヴィッド・F・フリードマン	デイヴィッド・フリードマン	デイビッド・フリードマン	
デイヴィッド・R・ホルジンガー	デイビッド・R・ホルジンガー	デイビッド・ホルジンガー	デヴィッド・ホルジンガー	デビッド・ホルジンガー	ホルジンガー	デヴィッド・R・ホルジンガー	デビッド・R・ホルジンガー	デイヴィッド・ホルジンガー	
デイヴィッド・S・ミラー	
デイヴィ・グレアム	デイヴィー・グラハム	デイヴィー・グレアム	
デイヴィ・チェイス	ダヴェイ・チェイス	
デイヴ・アナブル	
デイヴ・アーンソン	デイブ・アーンソン	
デイヴ・エヴァンス	
デイヴ・ガーン	
デイヴ・キットソン	
デイヴ・グルーシン	Dave_Grusin	デイブ・グルーシン	
デイヴ・グロール	デーブ・グロール	デイブ・グロール	
デイヴ・スチュワート_(ギタリスト)	
デイヴ・セイボ	
デイヴ・デイヴィス	
デイヴ・トーマス	
デイヴ・ナヴァロ	
デイヴ・バーソロミュー	デイブ・バーソロミュー	
デイヴ・フリッドマン	
デイヴ・ブルーベック	デイブ・ブルーベック	
デイヴ・マッキントッシュ	
デイヴ・マロウ	コリン・フィリプス	
デイヴ・マーレイ	
デイヴ・ムステイン	
デイヴ・ロンバード	
デウィット・クリントン	
デウォン・ブラゼルトン	デュウォン・ブラゼルトン	
デオダ・ドゥ・ドロミュー	
デオダ・ド・セヴラック	セヴラック	セブラック	デオダ・ドゥ・セヴラック	
デオドロ・ダ・フォンセカ	デオドロ・ダ・フォンセッカ	
デクスター・ゴードン	
デクスター・フレッチャー	
デクスター・ホーランド	デクスター・ホランド	
デクラン・クイン	
デジデリウス・エラスムス	デシデリウス・エラスムス	エラスムス	
デジレ・ドンデイヌ	デジレ・ドンディーヌ	
デジ・アーナズ	
デスピナ_(イルハン朝)	
デスピナ・ヴァンディ	
デズモンド・バグリィ	バグリィ	デズモンド・バグリイ	
デズモンド・ムピロ・ツツ	デズモンド・ツツ	ツツ	
デズモンド・モリス	裸のサル	
デズリー	
デットマール・クラマー	デトマール・クラマー	デッドマール・クラマー	
デデ・リンド	
デニウソン・ペレイラ・ネヴェス	
デニス・C・ブレア	
デニス・アルカポーン	
デニス・イストミン	
デニス・ウィルソン	
デニス・ウィーバー	
デニス・オッペンハイム	
デニス・クエイド	
デニス・クシニッチ	
デニス・ゴデアス	
デニス・ジョンソン	
デニス・チャベス	
デニス・ナイト	フィニアス・I・ゴッドウィン	テックス・スラシンジャー	ミディオン	フィニアス・ゴッドウィン	
デニス・ハスタート	ジョン・デニス・ハスタート	J・デニス・ハスタート	
デニス・ハルム	デニー・ハルム	Denny_Hulme	デニス・フルム	
デニス・フランツ	
デニス・ブラウン	
デニス・ブレイン	
デニス・ヘイスバート	デニス・ヘイズベルト	
デニス・ベグビー	
デニス・ベネット	
デニス・ベルカンプ	ベルカンプ	
デニス・ホッパー	
デニス・ホールマン	
デニス・ホー	何韻詩	
デニス・マック	麥子豪	
デニス・マツーエフ	
デニス・ミッチェル	
デニス・ミューレン	
デニス・メンショフ	
デニス・モシットー	
デニス・ラルストン	
デニス・リチャーズ	
デニス・リッチー	
デニス・ルヘイン	デニス・レヘイン	
デニス・ロッドマン	デニス・キース・ロッドマン	デニス・ロドマン	
デニス・ロー	
デニス・ワイズ	
デニー・ビル	デニー・ビール	
デニー・ランツァート	ダニー・ランツァート	
デニー・レイン	
デビット・クール	
デビッドソン・ニコル	
デビッド・アルブリットン	
デビッド・ウェナム	デヴィッド・ウェンハム	
デビッド・ウッドリー	
デビッド・エイゲンバーグ	
デビッド・エクスタイン	
デビッド・エンゲ	
デビッド・カウフマン	デヴィッド・カウフマン	
デビッド・カーター	
デビッド・キャッシュ	キッド・カッシュ	
デビッド・キャラダイン	デヴィッド・キャラダイン	デビッドキャラダイン	デイヴィッド・キャラダイン	デイヴィッドキャラダイン	
デビッド・クルサード	デビッド・マーシャル・クルサード	デヴィッド・クルサード	D.クルサード	デビクル	David_Coulthard	デービッド・クルサード	デイビッド・クルサード	デーヴィッド・クルサード	D・クルサード	
デビッド・クーパー_(野球)	
デビッド・ケイ	
デビッド・ジャンセン	デヴィッド・ジャンセン	
デビッド・チェリトン	
デビッド・テナント	デイビッド・テナント	
デビッド・ハッセルホフ	デヴィッド・ハッセルホフ	デイヴィッド・ハッセルホフ	
デビッド・バッティ	デーヴィッド・バッティ	デイヴィッド・バッティ	デヴィッド・バッティ	デービッド・バッティ	
デビッド・バーコウィッツ	ソン・オブ・サム	サムの息子	
デビッド・パターソン	デビット・パターソン	デービッド・パターソン	デイヴィッド・パターソン	
デビッド・パッカード	デイブ・パッカード	
デビッド・パーレイ	デイビッド・パーレイ	
デビッド・ファイロ	
デビッド・フューリー	デヴィッド・フューリー	
デビッド・ブレイン	デビット・ブレイン	
デビッド・プライス	
デビッド・ベイチュ	
デビッド・ベッカム	ベッキンガム宮殿	デービッド・ベッカム	デイヴィッド・ベッカム	デイビッド・ベッカム	デヴィッド・ベッカム	
デビッド・ホイーラー	
デビッド・ボルティモア	デイヴィッド・ボルティモア	デヴィッド・ボルティモア	
デビッド・マクドゥガル	
デビッド・マー	
デビッド・ムーアクロフト	
デビッド・ライオンズ	
デビッド・ライト	デービッド・ライト	
デビッド・ラシャペル	
デビッド・ラメルハート	ラメルハート	
デビッド・ランデス	
デビッド・ロイド・ジョージ	デイヴィッド・ロイド＝ジョージ	ロイド・ジョージ	デイヴィッド・ロイド・ジョージ	
デビッド・ロス_(マジシャン)	デビッド・ロス_(奇術師)	
デビッド・ロンギ	デヴィッド・ロンギ	
デビッド・ワーナー	
デビッド・E・ケリー	
デビッド・K・ワイアット	デビット・K・ワイアット	
デビ・メイザー	デビー・メイザー	
デビー・ウィルクス	デヴィー・ウィルクス	
デビー・スタム	
デビー・ムーア_(1933年生)	
デビー・ムーア_(1959年生)	
デビー・ライアン	
デビー・レイノルズ	
デフォレスト・ケリー	ディフォレスト・ケリー	ジャクソン・デフォレスト・ケリー	ジャクソン・ディフォレスト・ケリー	
デブラ・ウィンガー	
デブラ・メッシング	
デボラ・カー	
デボラ・カーラ・アンガー	
デボラ・ギブソン	デビー・ギブソン	
デボラ・シェルトン	
デボラ・ハリー	
デミ・ムーア	
デミ・ロヴァート	デミ・ロバート	
デメトリオ・ストラトス	
デモクリトス	
デモステネス	
デヤン・ボディロガ	
デュアン・オールマン	Duane_Allman	
デュアン・ジョーンズ	
デュション・モニーク・ブラウン	
デュディ・セラ	ドゥディ・セラ	
デュ・バリー夫人	デュバリー夫人	
デューイ・ラーソン	
デューク・エリントン	
デューク・カハナモク	デューク・パオア・カハナモク	
デューク・ジョーダン	
デューク・スナイダー	
デューク・ピアソン	
デューク・リード	デュークリード	トレジャー・アイル	
デリク・ガイラー	
デリシャ・ミルトン＝ジョーンズ	デリシャ・ミルトン・ジョーンズ	
デリック・ウィブリー	
デリック・クック	
デリック・シクア	デレク・シクア	
デリック・ローズ	
デリック・ワン	温兆倫	
デルク＝エルスコ・ブラインス	
デルタ・グッドレム	
デルバート・マン	
デルフィーヌ・セイリグ	
デルフィーノ・ボローニ	
デルフォ・カブレラ	
デルフォ・ゾルジ	
デルミラ・アグスティーニ	
デルロイ・ウィルソン	
デルロイ・リンドー	
デルヴィシュ・エロール	
デル・シャノン	
デレク・シェリニアン	
デレク・ジャコビ	
デレク・ジーター	ディレック・ジーター	ディレク・ジーター	デレック・ジーター	
デレク・トラックス	Derek_Trucks	
デレク・ビッカートン	
デレク・ルーク	
デレック・ガードナー	
デレック・バートン	
デンジル・ダグラス	
デンゼル・ワシントン	Denzel_Washington	
デンホルム・エリオット	
デヴィッド・C・H・オースティン	デヴィッド・オースティン	デビッド・オースチン	
デヴィッド・アンスポー	
デヴィッド・アーカンストーン	デイヴィッド・アーカンストーン	
デヴィッド・アークエット	
デヴィッド・アーチュレッタ	
デヴィッド・アーノルド	デイヴィッド・アーノルド	
