マル・ウォルドロン	
マレイ・アダスキン	アダスキン	
マレイ・ペライア	ペライア	マレー・ペライア	
マレイ・ラインスター	ラインスター	マレー・ラインスター	マレイ・レンスター	
マレク・エデルマン	
マレク・グレフタ	
マレク・サガノフスキ	
マレク・ハインツ	
マレク・マテヨフスキー	マレク・マテヨフスキ	
マレク・ヤンクロフスキ	マレク・ヤンクロフスキー	ヤンクロフスキ	
マレック・ベルカ	マレク・ベルカ	
マレック・ヴァルチェフスキ	
マレーネ・ディートリッヒ	マレーネ・ディートリヒ	マルレーネ・ディートリッヒ	マルレーネ・ディートリヒ	
マレー・ゲルマン	マレイ・ゲル＝マン	マレー・ゲル＝マン	
マレー・フィリューン	
マロシュ・シェフチョビチ	マロウシュ・シェフチョビッチ	
マロリー・ブラックマン	
マンサン	Mansun	
マンサー・オルソン	
マンディンゴ_(俳優)	
マンディ・チアン	蒋雅文	
マンディ・パティンキン	
マンディ・ベッツェル	
マンディ・ムーア	
マントノン侯爵夫人フランソワーズ・ドービニェ	マントノン夫人フランソワーズ・ドービニェ	マントノン侯爵夫人	マントノン夫人	
マンネ・シーグバーン	
マンフレッド・ブコフツァー	マンフレート・ブコフツァー	
マンフレッド・ヴィンケルホック	マンフレート・ヴィンケルホック	
マンフレート・アイゲン	マンフレッド・アイゲン	アイゲン	
マンフレート・カンター	
マンフレート・ゲルラッハ	
マンフレート・シュトルペ	
マンフレート・シュネルドルファー	マンフレッド・シュネルドルファー	
マンフレート・フォン・アルデンヌ	
マンフレート・フォン・リヒトホーフェン	マンフレッド・フォン・リヒトホーフェン	
マンフレート・ロンメル	
マンモハン・シン	マンモーハン・シン	マンモーハン・スィン	
マンリー・ウェイド・ウェルマン	マンリー・W・ウェルマン	
マン・モハン・アディカリ	アディカリ	マン・モハン・アドヒカリ	
マン・レイ	マン・レー	
マーウイヤ・ウルド・シディ・アハメド・タヤ	
マーカス・ガーベイ	マーカス・ガーヴェイ	マーカス・ガーヴィー	
マーカス・ダンスタン	
マーカス・テームズ	
マーカス・デュ・ソートイ	
マーカス・ハーネマン	マークス・ハーネマン	
マーカス・ホィットマン	
マーカス・ミラー	マーカスミラー	Marcus_Miller	
マーカス・リノ	
マーガレット_(イギリス王女)	
マーガレット・アトウッド	マーガレット・アットウッド	
マーガレット・オズボーン・デュポン	マーガレット・デュポン	マーガレット・オズボーン	
マーガレット・オブライエン	
マーガレット・オブ・アンジュー	マーガレット・アンジュー	
マーガレット・オブ・ヨーク	
マーガレット・キャンベル	
マーガレット・サッチャー	
マーガレット・サンガー	
マーガレット・スキート	
マーガレット・スクリブン	マーガレット・スクリベン	
マーガレット・ステュアート	
マーガレット・スペリングス	マーガレット・スペリングズ	
マーガレット・スミス・コート	マーガレット・コート	マーガレット・スミス	
マーガレット・セッドン	
マーガレット・テューダー	
マーガレット・トルーマン	メアリー・マーガレット・トルーマン	メアリー・マーガレット・トルーマン・ダニエル	
マーガレット・ドラブル	
マーガレット・バーク＝ホワイト	
マーガレット・バービッジ	エレノア・マーガレット・バービッジ	
マーガレット・フラー	サラ・マーガレット・フラー	
マーガレット・ブース	
マーガレット・ベケット	
マーガレット・ボーフォート	
マーガレット・ポール	
マーガレット・マーヒー	マーガレット・メイヒー	マーガレット・マヘイ	
マーガレット・マーラー	マーレル・マルギット	マルギット・マーレル	マーレル・マルギト	マーガレット・S・マーラー	マルガレート・マーラー	
マーガレット・ミッチェル	
マーガレット・ミラー	
マーガレット・ミード	
マーガレット・ラザフォード	
マーガレット・レア・セッドン	
マーガレット・ワイズ・ブラウン	Margaret_Wise_Brown	
マーク・アイシャム	
マーク・アディ	
マーク・アンソニー	
マーク・アンドリーセン	
マーク・アーモンド	
マーク・イザムバード・ブルネル	
マーク・インデリカート	
マーク・ウェバー	Mark_Webber	マーク・アラン・ウェバー	M.ウェバー	M・ウェバー	マーク・ウェーバー	マーク・ウエバー	
マーク・ウォーリス	
マーク・ウォールバーグ	マーク・ウォルバーグ	
マーク・エドワージー	
マーク・エルダー	
マーク・エヴァンス	
マーク・オリファント	
マーク・オーエン	マーク・オーウェン	
マーク・カヴェンディッシュ	マーク・カベンディッシュ	
マーク・カーニー	カーニー総裁	
マーク・ガスコイン	
マーク・ガードナー	
マーク・キング_(ベーシスト)	
マーク・キンセラ	
マーク・クリフトン	
マーク・ケアー	マーク・クアー	マーク・クァー	
マーク・サリング	
マーク・サンチェス	
マーク・サンドリッチ	
マーク・ザッカーバーグ	ザッカーバーグ	
マーク・ジェイコブス	マーク・ジェーコブス	マークジェイコブス	
マーク・スティーヴン・ジョンソン	
マーク・ストロング	
マーク・スピッツ	
マーク・セント・ジョン	
マーク・ダカスコス	
マーク・ダナヒュー	
マーク・チャップマン	マーク・デヴィッド・チャップマン	マーク・デイビッド・チャップマン	
マーク・ディレイニー	
マーク・デローサ	
マーク・トウェイン	トウェイン	マーク・トウェーン	マーク・トゥエイン	マーク・トゥエーン	マーク・_トウェーン	
マーク・トラクテンバーグ	
マーク・ノップラー	Mark_Knopfler	
マーク・ハットフィールド	
マーク・ハミル	
マーク・ハーモン	
マーク・バウチャー	
マーク・バレー	マーク・ヴァレー	
マーク・バーリー	
マーク・ファーバー	
マーク・フィドリッチ	
マーク・フィリプーシス	マーク・フィリポーシス	
マーク・フェルト	
マーク・フォスター	
マーク・フォーリー	
マーク・ブリッツスタイン	ブリッツスタイン	マーク・ブリッツステイン	
マーク・ブルカス	
マーク・ブレッシアーノ	マーク・ブレシアーノ	マルコ・ブレッシアーノ	マルコ・ブレシアーノ	
マーク・ブローグ	
マーク・プロトセヴィッチ	
マーク・ヘルプリン	
マーク・ヘンリー	
マーク・ペルグリノ	
マーク・ペーパーマスター	
マーク・ボラン	Marc_Bolan	
マーク・ボーチェック	マーク・ボセック	マーク・ボチェック	
マーク・ボール	
マーク・ボールズ	
マーク・マクレモア	マクレモア	
マーク・マンシーナ	
マーク・マーフィー_(歌手)	
マーク・ミッチャー	マーク・A・ミッチャー	
マーク・ミラー	
マーク・ミラー_(漫画家)	
マーク・モリス	
マーク・モーゼス	
マーク・ライデル	
マーク・ラファロ	
マーク・ランドール	
マーク・ラヴァルマナナ	
マーク・リッチ	
マーク・レイサム	
マーク・レスター	
マーク・レンショー	
マーク・ロスコ	
マーク・ロブソン	
マーク・ロルストン	
マーク・ロンソン	
マーク・ローレンス_(映画製作者)	
マーク・ヴァン	
マーク・E・ケリー	マーク・ケリー	マーク・エドワード・ケリー	
マーク・E・プラット	マーク・プラット	
マーク・L・レスター	
マーク・Z・ダニエレブスキー	
マーゴット・キダー	
マーゴ・フォンテイン	マーゴ・フォンテーン	マーゴット・フォンテーン	
マーゴ・ヘミングウェイ	
マーサ・クーリッジ	
マーサ・グレアム	マーサ・グラハム	
マーサ・スコット	
マーサ・スチュワート	
マーサ・ヌスバウム	
マーサ・ノレリウス	
マーサ・プリンプトン	
マーサ・ワシントン	
マーサ・ワシントン・ジェファーソン	マーサ・ワシントン・ジェファーソン・ランドルフ	マーサ・ジェファーソン・ランドルフ	マーサ・ジェファーソン	
マーサ・E・ロジャーズ	マーサ・ロジャーズ	
マーシア・ルーカス	マーシャ・ルーカス	
マーシャル・オールマン	
マーシャル・ジュウェル	マーシャル・ジュエル	
マーシャル・ストーン	マーシャル・ハーヴェー・ストーン	
マーシャル・ニーレンバーグ	
マーシャル・ハースコビッツ	マーシャル・ハースコヴィッツ	
マーシャル・フォーク	
マーシャル・ベル	
マーシャル・マクルーハン	マクルーハン	
マーシャル・R・ティーグ	
マーシャ・クロス	マーシア・クロス	
マーシャ・ゲイ・ハーデン	
マーシャ・ブラウン	
マーシャ・ボール	
マーシャ・メイソン	
マージェリー・アリンガム	マックスウェル・マーチ	マージェリー・ルイーズ・アリンガム	アリンガム	
マージェリー・シャープ	
マージョリー・ゲストリング	マジョリー・ゲストリング	
マージョリー・レイノルズ	
マージ・ショット	
マージ・ヘルゲンバーガー	
マース・カニンガム	マース・カニングハム	
マーセデス・マッケンブリッジ	
マーセデス・ラッキー	メルセデス・ラッキー	
マーセデス・ルール	メルセデス・ルール	
マーター・アムリターナンダマイー	アマチ	
マーチャーシュ1世	マティアス・コルヴィヌス	マーチャーシュ・コルヴィヌス	フニャディ・マーチャーシュ	
マーチン・パール	
マーチン・ヒューイット	
マーチン・ファン・クレフェルト	
マーチン・ホフマン	
マーチン・ポーター	マーチン_ポーター	Martin_porter	マーティン・ポーター	
マーティン・エヴァンズ	マーティン・エバンス	マーティン・エバンズ	マーティン・エヴァンス	
マーティン・ガードナー	マーチン・ガードナー	マーティンガードナー	
マーティン・キャンベル	
マーティン・キーオン	
マーティン・ケイディン	
マーティン・シュヴァルツシルト	マルティン・シュヴァルツシルト	マーチン・シュヴァルツシルト	マルティン・シュワルツシルト	
マーティン・ショー	
マーティン・ショート	
マーティン・シーン	マーチン・シーン	
マーティン・スコセッシ	マーチン・スコセッシ	スコセッシ	
マーティン・スパンジャーズ	
マーティン・セリグマン	
マーティン・ソレル	マーチン・ソレル	
マーティン・タイラー	
マーティン・チャルフィー	マーティン・チャルフィ	
マーティン・ディーゴ	
マーティン・デニー	
マーティン・ドネリー	
マーティン・ドノヴァン	
マーティン・ニーベラ	マーティン・ニーヴェラ	
マーティン・ハルニック	マルティン・ハルニク	
マーティン・バシール	
マーティン・バルサム	
マーティン・ヒデン	
マーティン・ファウラー	マーチン・ファウラー	
マーティン・フリーマン	
マーティン・ブランドル	Martin_Brundle	
マーティン・ブレスト	
マーティン・ヘルマン	マーチン・ヘルマン	
マーティン・ヘンダーソン	
マーティン・ポッター	
マーティン・マル	
マーティン・メイリア	
マーティン・ヤン	
マーティン・ライル	マーチン・ライル	サー・マーティン・ライル	
マーティン・ランドー	マーチン・ランドー	
マーティン・リット	
マーティン・ルーサー・キング・ジュニア	MLK	キング牧師	マーチン・ルーサー・キング・ジュニア	マーチン・ルーサー・キング非暴力・人道賞	マーティン・ルーサー・キング	マーチン・ルーサー・キング	
マーティン・ロッドベル	
マーティン・ワイト	
マーティン・ヴァン・ビューレン	マーティン・ヴァンビューレン	ビューレン	マーチン・ヴァン・ビューレン	マーティン・V・ビューレン	
マーティ・サーボ	
マーティ・フリードマン	マーティン・フリードマン	マーティー・フリードマン	マーティフリードマン	マーチン・フリードマン	
マーティーン・フェレロ	
マーティー・マリオン	マーティ・マリオン	
マーディ・フィッシュ	マーディー・フィッシュ	
マートル・クック	
マートル・ゴンザレス	
マートン・チョーカシュ	
マートン・ミラー	
マードル・フェレンツ	フェレンツ・マードル	
マーナ・ロイ	マーナ・ローイ	
マーニー・ケネディー	
マーハン・カリミ・ナセリ	ナセリ	
マービン・ミラー	
マービン・ミンスキー	マーヴィン・ミンスキー	
マーブ・スロンベリー	マーブ・スローンベリー	
マーマデューク・パトル	
マーラ・ウィルソン	
マーラ・カルファーニャ	
マーリオ・リゴーニ・ステルン	
マーリス・シュトロムベルグス	
マーリー・シェルトン	
マーリー・マトリン	
マールテン・チャリンヒー	
マールバラ公ジョン・チャーチル	マルボロ公ジョン・チャーチル	モールバラ公ジョン・チャーチル	ジョン・チャーチル	
マール・オベロン	
マーレイ・マッカリー	
マーロン・ウェイアンズ	
マーロン・ディカーソン_(ニュージャージー州の政治家)	
マーロン・ブランド	
マーロン・ヘアウッド	
マーヴィン・キング	キング総裁	マービン・キング	
マーヴィン・ゲイ	マービン・ゲイ	
マーヴィン・ハムリッシュ	
マーヴィン・ハリス	
マーヴィン・ピーク	マービン・ピーク	マービン・ローレンス・ピーク	マーヴィン・ローレンス・ピーク	
マーヴィン・ルロイ	マービン・ルロイ	
マーヴ・グリフィン	
ミア・カーシュナー	
ミア・ドイ・トッド	
ミア・ファロー	ミア・ファロウ	
ミア・マエストロ	
ミア・ワシコウスカ	
ミウトン・ケイロス・ダ・パイション	チッタ	
ミェシュコ1世_(チェシン公)	
ミカエラ・コンリン	
ミカエル・アグリコラ	
ミカエル・シルヴェストル	ミカエル・シルベストル	
ミカエル・ジャン	ミシェル・ジャン	
ミカエル・ドラージュ	
ミカエル・ニクヴィスト	
ミカエル・ハフストローム	
ミカエル・ヒュープナー	ミヒャエル・ヒュプナー	ミハエル・ヒューブナー	
ミカエル・ピューピン	
ミカエル・フォルセル	
ミカエル・メルケフ	
ミカエル・ヤコブセン	
ミカエル・ラウドルップ	
ミカエル・ランドロー	
ミカエル・ロドラ	
ミカロユス・チュルリョーニス	ミカロユス・コンスタンティナス・チュルリョーニス	チュルリョーニス	
ミカ・カウリスマキ	
ミカ・ハッキネン	Mika_Hakkinen	ハッキネン	
ミカ・ワルタリ	
ミキオ・ハセモト	
ミキス・テオドラキス	テオドラキス	
ミキ・マノイロヴィッチ	
ミキ・ヨン	楊愛瑾	
ミクラーシュ・ズリンダ	
ミクローシュ・ヤンチョー	ミクロシュ・ヤンチョー	
ミケランジェロ・アントニオーニ	
ミケランジェロ・ブオナローティ	ミケランジェロ・ブオナロッティ	ミケランジェロ	ミケランジェロ・ブオナッローティ	
ミケランジェロ・メリージ・ダ・カラヴァッジオ	メリージ	ミケランジェロ・メリージ	カラバァッジョ	カラヴァッジォ	
ミケランジェロ・ランプッラ	
ミケルティ・ウィリアムソン	
ミケル・アスタルロサ	ミケル・アスタローザ	
ミケル・アロンソ	
ミケル・サン・ホセ	
ミケル・シトウ	
ミケル・ジョン・オビ	ジョン・オビ・ミケル	
ミケル・ニエベ	
ミケーレ・アルボレート	Michele_Alboreto	
ミケーレ・グレコ	
ミケーレ・シンドーナ	
ミケーレ・スカルポーニ	
ミケーレ・ナヴァーラ	
ミケーレ・バルトリ	
ミケーレ・パオルッチ	
ミケーレ・パツィエンツァ	
ミゲル1世_(ポルトガル王)	ミゲル1世	
ミゲル・アコスタ	ミゲール・アコスタ	
ミゲル・アンヘル・アストゥリアス	ミゲル・アンヘル・アストリアス	
ミゲル・アンヘル・カステリーニ	
ミゲル・アンヘル・ゴンサレス_(サッカー選手)	
ミゲル・アンヘル・デ・ラ・フロール	
ミゲル・イダルゴ	
ミゲル・カロー	
ミゲル・カント	
ミゲル・コバルビアス	
ミゲル・デリーベス	
ミゲル・デ・イカザ	
ミゲル・デ・ウナムーノ	ウナムノ	ドン・ミゲル・デ・ウナムノ	ドン・ミゲル・デ・ウナムーノ	ウナムーノ	ミゲル・デ・ウナムノ	
ミゲル・デ・オリベイラ	
ミゲル・デ・セルバンテス	セルヴァンテス	セルバンテス	セルバンデス	
ミゲル・デ・ラ・マドリード・ウルタード	ミゲル・デ・ラ・マドリ・ウルタド	ミゲル・デ・ラ・マドリード	
ミゲル・フェラー	ミゲル・ファーラー	
ミゲル・プリモ・デ・リベラ	プリモ・デ・リベラ	ミゲル・プリモ・デ・リベーラ	プリモ・デ・リベーラ	
ミゲル・ベルナル＝ヒメネス	ベルナル・ヒメネス	ミゲル・ベルナル・ヒメネス	ベルナル＝ヒメネス	
ミゲル・ホワイト	
ミゲル・ポブレット	
ミゲル・ムニョス	
ミゲル・ラエラ	
ミゲル・リッティン	ミゲル・リティン	
ミゲル・リョベート	ミゲル・リョベット＝ソレス	ミゲル・リョベット	
ミゲル・レイナ	
ミゲル・ロペス・デ・レガスピ	
ミゲール・コット	ミゲル・コット	
ミゲール・デルトロ	
ミコラ・アザロフ	
ミコラ・コレッサ	コレッサ	
ミコワイ・クシシュトフ・ラジヴィウ・シェロトカ	
ミコワイ・ラジヴィウ・チャルヌィ	ミコワイ・ラジヴィウ・チャルニィ	
ミザン・ザイナル・アビディン	
ミシェリー・ジョーンズ	
ミシェル・アリニョン	
ミシェル・アリヨ＝マリー	ミシェール・アリヨ＝マリー	ミシェル・アリヨ・マリー	ミシェル・アリヨマリ	
ミシェル・アルヴス	ミシェル・アルブス	
ミシェル・アンリ	
ミシェル・ウィリアムズ_(女優)	ミシェル・ウィリアムズ_(俳優)	ミシェル・イングリッド・ウィリアムズ	
ミシェル・ウィー	ミシェルウィー	
ミシェル・ウエルベック	
ミシェル・オバマ	
ミシェル・オークレール	
ミシェル・クルージ	
ミシェル・クワン	ミッシェル・クワン	
ミシェル・コロンビエ	Michel_Colombier	
ミシェル・ジョベール	
ミシェル・ジョンソン	
ミシェル・ステー	
ミシェル・スライマーン	ミッシェル・スレイマン	ミシェル・スレイマン	
ミシェル・セルヴェ	
ミシェル・セロー	
ミシェル・デュショソワ	
ミシェル・トゥルニエ	ミッシェル・トゥルニエ	
ミシェル・トラクテンバーグ	ミシェル・トラッチェンバーグ	
ミシェル・ドブレ	
ミシェル・ドヴィル	
ミシェル・ド・セルトー	セルトー	
ミシェル・ド・モンテーニュ	モンテーニュ	
ミシェル・ナヴラティル	マイケル・ナブラチル	
ミシェル・ネイ	ネイ	
ミシェル・バチェレ	ミチェル・バチェレ	バチェレ	
ミシェル・バックマン	
ミシェル・バルニエ	ミシェル・バルニエール	
ミシェル・ビュトール	ビュトール	
ミシェル・ピコリ	ミシェル・ピッコリ	
ミシェル・ファイファー	Michelle_Pfeiffer	ミッシェル・ファイファー	
ミシェル・ファン・デル・アー	
ミシェル・ファン	ミッシェル・ファン	MichellePhan	
ミシェル・フィリップス	
ミシェル・フーコー	ミッシェル・フーコー	
ミシェル・ブランチ	
ミシェル・ブロー	
ミシェル・ブーケ	
ミシェル・プラッソン	
ミシェル・プラティニ	プラティニ	ミッシェル・プラティニ	
ミシェル・ボワロン	
ミシェル・ポランティエール	ミッシェル・ポランティエール	
ミシェル・マゴリアン	
ミシェル・マテリ	ミシェル・マーテリー	
ミシェル・メスリン	
ミシェル・メルシェ_(俳優)	
ミシェル・メルシエ_(政治家)	
ミシェル・モナハン	
ミシェル・モルガン	
ミシェル・モーガン	
ミシェル・ランベール	
ミシェル・リヴァジ	
ミシェル・ルグラン	
ミシェル・レリス	レリス	
ミシェル・ロカール	
ミシェル・ロドリゲス	
ミシェール・ヨー	ミシェル・ヨー	ミシェール・キング	楊紫瓊	
ミシェール・ワイ	詩雅	
ミシュリン・カルミー＝レイ	ミシュリン・カルミレイ	
ミシュリーヌ・オステルメイヤー	
ミシュリーヌ・ボーシュマン	
ミシュリーヌ・ラノア	
ミスター・ギロチン	
ミスター・マーカス	
ミスター・T	Mr.T	ミスターT	Mr._T	
ミスティカル_(ラッパー)	
ミスティ・メイトレーナー	ミスティ・メイトリノール	
ミステル・ニエブラ	
ミズーリ_(戦艦)	戦艦ミズーリ	
ミゼンゴ・ピンダ	
ミチオ・カク	加來紀雄	加來道雄	加来道雄	
ミッキー・ウェルチ	
ミッキー・カクレーン	
ミッキー・カンター	
ミッキー・ギャラガー	ミック・ギャラガー	
ミッキー・コーエン	
ミッキー・ジェームス	
ミッキー・スピレイン	フランク・モリスン・スピレイン	ミッキー・スピレーン	マイク・ハマー	
ミッキー・ディー	
ミッキー・ドレンツ	
ミッキー・バーノン	
ミッキー・マントル	
ミッキー・ムーディ	
ミッキー・モスト	
ミッキー・ルーニー	
ミッキー・ローク	猫パンチ	
ミック・カーン	Anthony_Michaelides	アンソニー・ミカエリデス	
ミック・グリーン	
ミック・ジャガー	Mick_Jagger	
ミック・ジョーンズ_(ザ・クラッシュ)	
ミック・ジョーンズ_(フォリナー)	
ミック・テイラー	
ミック・フリートウッド	Mick_Fleetwood	
ミック・マッカーシー	
ミック・マーズ	
ミック・ロンソン	
ミッケル・ケスラー	ミケル・ケスラー	
ミッコ・エスコ	
ミッコ・オイヴァネン	
ミッコ・ハルキン	
ミッコ・ロンカイネン	
ミッシェル・リー	李嘉欣	ミシェール・リー	ミシェル・リー	
ミッシャ・ディヒター	ディヒター	
ミッシー・エリオット	
ミッシー・パイル	
ミッシー_(女優)	
ミッチェル・ムッソ	
ミッチ・ダニエルズ	
ミッチ・ヒューワー	
ミッチ・マコーネル	
ミッチ・ミッチェル	
ミッチー・ラブ	ミッチーラブ	
ミット・ロムニー	ウィラード・M・ロムニー	W・ミット・ロムニー	ウィラード・ミット・ロムニー	ウィラード・ロムニー	
ミトロファン・ニェジェーリン	ミトロファン・ネデリン	ネーデリン	ネデリン	
ミニー・ドライヴァー	ミニー・ドライバー	
ミニー・リパートン	Minnie_Riperton	
ミノル・ヤマサキ	
ミハイ1世_(ルーマニア王)	ミハイ1世	
ミハイル・アレクサンドロヴィチ_(1878-1918)	ミハイル・アレクサンドロヴィチ大公	
ミハイル・イサコフスキー	
ミハイル・ウリヤーノフ	
ミハイル・カシヤノフ	
ミハイル・カラシニコフ	ミハイル・ティモッフィーヴィッチ・カラシニコフ	
ミハイル・カラトーゾフ	ミヘイル・カラトジシヴィリ	
ミハイル・カリーニン	
ミハイル・グネーシン	グネーシン	
ミハイル・グリンカ	グリンカ	
ミハイル・グロモフ	
ミハイル・ゲラシモフ	
ミハイル・ゴルトシュタイン	ミヒャエル・ゴルトシュタイン	
ミハイル・ゴルバチョフ	ミハエル・セルゲイビッチ・ゴルバチョフ	ゴルビー	ミハイル・セルゲーエヴィッチ・ゴルバチョフ	ゴルバチョフ	
